{"meta":{"git":{"commit_sh":"2723ff6","commit_lh":"2723ff62e83e33610e28b88d35db5e7278b6df04","commit_date":"2022-01-06 20:46:39 +0100","github":"https:\/\/github.com\/wasserbombe\/lucafail-timeline"},"urls":["https:\/\/timeline.luca.fail\/","https:\/\/timeline.luca.fail\/?date={{YYYY-MM-DD}}","https:\/\/timeline.luca.fail\/?panel={{id}}","https:\/\/timeline.luca.fail\/?panel={{id_readable}}"],"ts":1641503191,"date":"2022-01-06"},"timeline":[{"date":"01.02.2021","dt_created":"2021-02-01 00:00:00","dt_updated":"2021-02-01 00:00:00","id":"b45d6c5a8adc","id_readable":"2021-02-01_Februar-2021-und-frher","text":"Fehlt noch und m\u00fcsste erg\u00e4nzt werden. Gerne auch auf <a href=\"http:\/\/edit.luca.fail\/\">edit.luca.fail<\/a> eintragen!","title":"Februar 2021 und fr\u00fcher"},{"date":"02.03.2021","dt_created":"2021-03-02 00:00:00","dt_updated":"2021-03-02 00:00:00","id":"7f308a500750","id_readable":"2021-03-02_doc_Stellungnahme-des-LfDI-Baden-Wrttemberg-zur-App-Luca","links":[{"url":"https:\/\/www.baden-wuerttemberg.datenschutz.de\/wp-content\/uploads\/2021\/04\/Stellungnahme-LfDI-BW-Luca-App.pdf","text":"Stellungnahme-LfDI-BW-Luca-App.pdf"}],"scope":"Land: Baden-W\u00fcrttemberg","text":"(fehlt)","title":"Stellungnahme des LfDI Baden-W\u00fcrttemberg zur App Luca","type":"doc"},{"date":"08.03.2021","dt_created":"2021-03-08 00:00:00","dt_updated":"2021-03-08 00:00:00","id":"39edc65f60db","id_readable":"2021-03-08_doc_D64-Fnf-Forderungen-an-eine-bundesweite-Check-In-App-zur-Kontaktnachverfolgung","links":[{"url":"https:\/\/d-64.org\/check-in-app\/","text":"D64: F\u00fcnf Forderungen an eine bundesweite Check-In-App zur Kontaktnachverfolgung"}],"scope":"Bundesweit","text":"Das D64 \u2013 Zentrum f\u00fcr Digitalen Fortschritt e.V. ver\u00f6ffentlicht seine f\u00fcnf Anforderungen an eine bundesweite Check-In-App zur Kontaktnachverfolgung.<br><br><ul><li><b>Whitepaper:<\/b> Vollst\u00e4ndige Dokumentation und Transparenz des Dienstes und seiner Schnittstellen, sowie der zu verarbeitenden Daten mit Erl\u00e4uterung der kryptografischen Verfahren.<\/li><li><b>Open Source:<\/b> Die Ver\u00f6ffentlichung des Quellcodes aller Komponenten des Dienstes, von den Smartphone-Apps bis zu Backend-Services.<\/li><li><b>Datensparsamkeit:<\/b> Es d\u00fcrfen nur Daten erhoben werden, die zum Betrieb des Dienstes zwingend notwendig sind. Zugriff auf personenbezogene Daten d\u00fcrfen nur die Gesundheits\u00e4mter in einem Infektionsfall erhalten. Einen \u201eGeneralschl\u00fcssel\u201c zum Zugriff auf alle Daten darf es nicht geben.<\/li><li><b>Barrierefreiheit:<\/b> Der Dienst muss von allen Menschen mit unterschiedlichen mobilen Endger\u00e4ten bedient werden k\u00f6nnen.<\/li><li><b>Serverstandort:<\/b> Alle Daten d\u00fcrfen nur auf Servern der EU verarbeitet werden.<\/li><\/ul>","title":"D64: F\u00fcnf Forderungen an eine bundesweite Check-In-App zur Kontaktnachverfolgung","type":"doc","verified":true},{"date":"08.03.2021","dt_created":"2021-03-08 00:00:00","dt_updated":"2021-03-08 00:00:00","embed":[{"type":"fragdenstaat","id":"214626"}],"id":"136e20b949bd","id_readable":"2021-03-08_fragdenstaat_fragdenstaatde-Vereinbarung-mit-Luca-App","links":[{"url":"https:\/\/fragdenstaat.de\/a\/214626","text":"https:\/\/fragdenstaat.de\/a\/214626"}],"scope":"Land: Mecklenburg-Vorpommern","tags":["vertrag"],"text":"","title":"fragdenstaat.de: Vereinbarung mit Luca App","type":"fragdenstaat"},{"date":"18.03.2021","dt_created":"2021-03-18 00:00:00","dt_updated":"2021-03-18 00:00:00","figures":[{"type":"table","data":{"header":["Bundesland","Kosten","Kosten\u00fcbernahme?","Vertragslaufzeit","Anonyme KV?","Anmerkungen"],"rows":[["Bayern","5.500.000\u20ac","?","?","Nicht m\u00f6glich laut CoronaVO","-"],["Baden-W\u00fcrttemberg","3.700.000\u20ac","?","?","Nicht m\u00f6glich laut CoronaVO","3.117.000\u20ac laut https:\/\/fragdenstaat.de\/a\/216802"],["Niedersachsen","3.000.000\u20ac","?","?","Nicht m\u00f6glich laut CoronaVO","2.521.580 EUR (netto) laut https:\/\/fragdenstaat.de\/a\/220970"],["Hessen",">2.000.000\u20ac","?","?","Nicht m\u00f6glich laut CoronaVO","-"],["Rheinland-Pfalz","1.726.190\u20ac","Laut Land: Ersten 18 Monate durch Bund","?","Nicht m\u00f6glich laut CoronaVO","1.450.580 \u20ac netto; Enthalten: Implementierung und Betrieb der Software; Unterst\u00fctzung bei deren Einf\u00fchrung auf Seiten der kommunalen und\/oder Landesgesundheitsbeh\u00f6rden; den Betrieb und die Unterst\u00fctzung bei der Einf\u00fchrung der Software auf Seiten der Betreiber\/\u201dGastgeber\u201d; Unterst\u00fctzung im Rahmen der Einf\u00fchrung und Nutzung im jeweiligen Bundesland; Einmalbetrag f\u00fcr SMS-Kosten."],["Berlin","1.389.920\u20ac","Laut Land: Ersten 18 Monate durch Bund","22.03.2021 - 21.03.2022<br>Automatische Verl\u00e4ngerung, K\u00fcndigungsfrist 1 Monat","?","1.168.000 \u20ac netto, aufgeteilt auf:<br>216.000 \u20ac Lizenz- und Wartungskosten<br>672.000 \u20ac Betrieb Backend \/ Infrastruktur<br>280.000 \u20ac Einmalkosten f\u00fcr Inbetriebnahme<br>Ab dem Jahr 2022 j\u00e4hrliche Kosten i.H.v. 888.000 \u20ac. Schl\u00fcsselanh\u00e4nger werden getrennt verhandelt."],["Sachsen-Anhalt","~1.000.000\u20ac","?","?","?","?"],["Schleswig-Holstein","~1.000.000\u20ac","?","?","?","?"],["Brandenburg","990.000\u20ac","?","?","Nicht m\u00f6glich laut VO","?"],["Hamburg","615.000\u20ac","?","?","?","460k laut Riedel?"],["Mecklenburg-Vorpommern","440.776","?","12.03.2021 - 11.03.2022","?","230.400\u20ac f\u00fcr Software, Betrieb & Co.<br>140.000\u20ac f\u00fcr SMS-Verifizierung"],["Saarland","369.090\u20ac","?","?","?","+45.888,68\u20ac f\u00fcr Werbekampagne der Staatskanzlei (https:\/\/fragdenstaat.de\/a\/224799)"],["Bremen","~260.000\u20ac","?","?","?","?"],["Nordrhein-Westfalen","0\u20ac","?","-","?","NRW setzt auf offene Standards wie IRIS und hat die Luca App nicht lizenziert - zumindest nicht als Bundesland."],["Sachsen","0\u20ac","?","-","Anonym m\u00f6glich","Einzelne St\u00e4dte wie Chemnitz und Mei\u00dfen nutzen Luca, Sachsen selbst setzt allerdings auf die Corona-Warn-App und schafft entsprechende rechtliche Rahmenbedingungen. "],["Th\u00fcringen","?","?","?","Laut Stadt Jena CWA m\u00f6glich, laut Landesverordnung (!) nicht.","Nur in einzelnen St\u00e4dten? U.a. Stadt Jena"]]}}],"id":"a974424c9137","id_readable":"2021-03-18_research_Recherche-Kosten-der-Luca-App-im-berblick","links":[{"text":"\u201cLuca-App: Mecklenburg-Vorpommern beginnt mit Kontaktverfolgung\u201d (heise.de)","url":"https:\/\/www.heise.de\/news\/Luca-App-Mecklenburg-Vorpommern-beginnen-mit-Kontaktverfolgung-5987369.html"},{"text":"\u201cCheck-In im Biergarten: NRW setzt auf offene L\u00f6sung\u201d (wdr.de)","url":"https:\/\/www1.wdr.de\/nachrichten\/landespolitik\/luca-nrw-corona-warn-app-plaene-100.html"},{"text":"\u201cKontaktverfolgung durch \"Luca\"-App \u2013 in Sachsen noch nicht \u00fcberall Thema\u201d (mdr.de)","url":"https:\/\/www.mdr.de\/nachrichten\/deutschland\/politik\/luca-app-kontaktverfolgung-100.html"},{"text":"\u201cKontaktnachverfolgung: Sachsen setzt auf Corona-Warn-App statt Luca\u201d (t3n.de)","url":"https:\/\/t3n.de\/news\/kontaktnachverfolgung-sachsen-corona-warn-app-1376787\/"},{"text":"\u201cDigitale Kontaktverfolgung: Mehr als 20 Millionen Euro f\u00fcr Luca\u201d (netzpolitik.de)","url":"https:\/\/netzpolitik.org\/2021\/digitale-kontaktverfolgung-fast-20-millionen-euro-fuer-luca\/"},{"text":"\u201cSenatsverwaltung f\u00fcr Gesundheit, Pflege und Gleichstellung, Rote Nr. 3379 N\u201d (parlament-berlin.de)","url":"https:\/\/www.parlament-berlin.de\/adosservice\/18\/Haupt\/vorgang\/h18-3379.O-v.pdf"},{"text":"\u201cSenatsverwaltung f\u00fcr Gesundheit, Pflege und Gleichstellung, Rote Nr. 3379 N\u201d (parlament-berlin.de)","url":"https:\/\/pardok.parlament-berlin.de\/starweb\/adis\/citat\/VT\/18\/SchrAnfr\/s18-27534.pdf"},{"text":"Landtag Mecklenburg-Vorpommern: KLEINE ANFRAGE der Abgeordneten Eva-Maria Kr\u00f6ger, Fraktion DIE LINKE - Lizenzkauf Luca-App","url":"https:\/\/www.dokumentation.landtag-mv.de\/parldok\/dokument\/49980\/lizenzkauf_luca_app.pdf"}],"scope":"Bundesweit","tags":["kosten"],"text":"Die folgende Tabelle zeigt eine \u00dcbersicht \u00fcber die Kosten, die in den einzelnen Bundesl\u00e4ndern f\u00fcr die Luca-App angefallen sind. Die Daten wurden aus unterschiedlichen Quellen (IFG-Anfragen, Fragen in Parlamenten, Medienberichten, etc. zursammengetragen - diese Quellen sind in der Linkliste aufgelistet.","title":"Recherche: Kosten der Luca-App im \u00dcberblick","type":"research","verified":true},{"date":"21.03.2021","dt_created":"2021-03-21 00:00:00","dt_updated":"2021-03-21 00:00:00","embed":[{"type":"tweet","url":"https:\/\/twitter.com\/HonkHase\/status\/1373607440600735744"}],"id":"e41431cfcb7d","id_readable":"2021-03-21_incident_Transparenz-Wichtige-Dokumente--Verffentlichungen-fehlen---immer-noch","tags":[],"text":"Unter anderem fehlen\/fehlten bis zum 21.03.:<ul><li>DSFA (Datenschutz-Folgeabsch\u00e4tzung)<\/li><li>Abgleich mit den Anforderungen an Contact-Tracing-Apps des Chaos Computer Clubs<\/li><li>Abgleich mit den Anforderungen an Contact-Tracing-Apps des D64 e.V.<\/li><li>Angaben zum Key Management<\/li><li>Angaben zur Architektur<\/li><\/ul>","title":"Transparenz: Wichtige Dokumente \/ Ver\u00f6ffentlichungen fehlen - immer noch","type":"incident"},{"date":"21.03.2021","dt_created":"2021-03-21 00:00:00","dt_updated":"2021-03-21 00:00:00","embed":[{"type":"fragdenstaat","id":"216210"}],"id":"2b125c452d8e","id_readable":"2021-03-21_fragdenstaat_fragdenstaatde-Vertrag--Kosten-zur-Nutzung-der-Luca-App","links":[{"url":"https:\/\/fragdenstaat.de\/a\/216210","text":"https:\/\/fragdenstaat.de\/a\/216210"}],"scope":"Land: Berlin","tags":["vertrag","kosten"],"text":"","title":"fragdenstaat.de: Vertrag & Kosten zur Nutzung der Luca App","type":"fragdenstaat"},{"date":"23.03.2021","dt_created":"2021-03-23 00:00:00","dt_updated":"2021-03-23 00:00:00","embed":[{"type":"tweet","url":"https:\/\/twitter.com\/thsStadler\/status\/1374319093449375747"}],"id":"07ecbb948620","id_readable":"2021-03-23_doc_Preliminary-Analysis-of-Potential-Harms-in-the-Luca-Tracing-System","links":[{"url":"https:\/\/arxiv.org\/pdf\/2103.11958.pdf","text":"PDF: Preliminary Analysis of Potential Harms in the Luca Tracing System"}],"scope":"Bundesweit","tags":["paper","metadata"],"text":"Potential harms a large-scale deployment of the Luca system might cause to individuals, venues, and communities - paper by Theresa Stadler, Wouter Lueks, Kathatina Kohls, Carmela Troncoso","title":"\u201cPreliminary Analysis of Potential Harms in the Luca Tracing System\u201d","type":"doc"},{"date":"24.03.2021","dt_created":"2021-03-24 00:00:00","dt_updated":"2021-03-24 00:00:00","embed":[{"type":"fragdenstaat","id":"216557"}],"id":"647c9703aae5","id_readable":"2021-03-24_fragdenstaat_fragdenstaatde-Prfung-der-LucaApp-und-weiterer-Systeme","links":[{"url":"https:\/\/fragdenstaat.de\/a\/216557","text":"https:\/\/fragdenstaat.de\/a\/216557"},{"url":"https:\/\/www.volksfreund.de\/region\/rheinland-pfalz\/corona-lockdown-an-ostern-diese-regeln-gelten-jetzt-in-rheinland-pfalz_aid-56956987","text":"volksfreund.de: Neue Beschl\u00fcsse - Scharfer Corona-Lockdown an Ostern: Diese Corona-Regeln gelten jetzt in Rheinland-Pfalz"}],"scope":"Land: Rheinland-Pfalz","tags":["vertrag","pr\u00fcfung","malu-dreyer","datenschutz","rheinland-pfalz"],"text":"Ergebnis: Landesbeauftragter f\u00fcr Datenschutz und Informationsfreiheit war nicht an der Pr\u00fcfung beteiligt.","title":"fragdenstaat.de: Pr\u00fcfung der LucaApp und weiterer Systeme","type":"fragdenstaat"},{"date":"24.03.2021","dt_created":"2021-03-24 00:00:00","dt_updated":"2021-03-24 00:00:00","embed":[{"type":"youtube","id":"dApEeaPn9bk"}],"id":"b89cffef8ef4","id_readable":"2021-03-24_podcast_Anke-Domscheit-Berg-Stand-Corona-Warn-App-und-Datenschutzfragen-anderer-Check-In-Apps-Video","text":"","title":"Anke Domscheit-Berg: \u201cStand Corona-Warn-App und Datenschutzfragen anderer Check-In Apps\u201d (Video)","type":"podcast"},{"date":"24.03.2021","dt_created":"2021-03-24 00:00:00","dt_updated":"2021-03-24 00:00:00","id":"1a9d6315d9f5","id_readable":"2021-03-24_incident_Schwachstelle-Scanner-URLs-offen-Nutzer-im-Namen-von-Locations-eincheckbar-Auslastung-in-Echtzeit-auslesbar","links":[],"tags":["luca-api","luca-backend"],"text":"Impact: Alle Nutzer \/ Locations","title":"Schwachstelle: Scanner-URLs offen, Nutzer im Namen von Locations eincheckbar, Auslastung in Echtzeit auslesbar","type":"incident"},{"date":"24.03.2021","dt_created":"2021-03-24 00:00:00","dt_updated":"2021-03-24 00:00:00","embed":[{"type":"fragdenstaat","id":"216556"}],"id":"647c9703aae57","id_readable":"2021-03-24_fragdenstaat_fragdenstaatde-Prfung-der-LucaApp-und-weiterer-Systeme","links":[{"url":"https:\/\/fragdenstaat.de\/a\/216556","text":"https:\/\/fragdenstaat.de\/a\/216556"},{"url":"https:\/\/www.volksfreund.de\/region\/rheinland-pfalz\/corona-lockdown-an-ostern-diese-regeln-gelten-jetzt-in-rheinland-pfalz_aid-56956987","text":"volksfreund.de: Neue Beschl\u00fcsse - Scharfer Corona-Lockdown an Ostern: Diese Corona-Regeln gelten jetzt in Rheinland-Pfalz"}],"scope":"Land: Rheinland-Pfalz","tags":["vertrag","pr\u00fcfung","malu-dreyer","datenschutz","rheinland-pfalz"],"text":"Ergebnis: Landesbeauftragter f\u00fcr Datenschutz und Informationsfreiheit sei beteiligt gewesen, eine <a href=\"https:\/\/fragdenstaat.de\/a\/216557\">Anfrage bei ihm<\/a> zeigte aber, dass er es nicht war.","title":"fragdenstaat.de: Pr\u00fcfung der LucaApp und weiterer Systeme","type":"fragdenstaat"},{"date":"25.03.2021","dt_created":"2021-03-25 00:00:00","dt_updated":"2021-03-25 00:00:00","embed":[{"type":"fragdenstaat","id":"216610"}],"id":"e1a8a03de72e","id_readable":"2021-03-25_fragdenstaat_fragdenstaatde-EILT---Gefahr-in-Verzug-Luca-App---datenschutzrechtliche-Probleme","links":[{"url":"https:\/\/fragdenstaat.de\/a\/216610","text":"https:\/\/fragdenstaat.de\/a\/216610"}],"scope":"Land: Berlin","tags":["vertrag","datenschutz"],"text":"","title":"fragdenstaat.de: EILT - Gefahr in Verzug! Luca-App - datenschutzrechtliche Probleme","type":"fragdenstaat"},{"date":"25.03.2021","dt_created":"2021-03-25 00:00:00","dt_updated":"2021-03-25 00:00:00","id":"802eddd241f2","id_readable":"2021-03-25_doc_ticketio-Luca-App-und-Ticket-IO-gehen-Kooperation-ein","links":[{"url":"https:\/\/landing.ticket.io\/news\/ticket-i-o-und-luca-gehen-kooperation-ein","text":"https:\/\/landing.ticket.io\/news\/ticket-i-o-und-luca-gehen-kooperation-ein"},{"url":"https:\/\/www.volksfreund.de\/pr\/presseportal\/luca-app-und-ticket-i-o-gehen-kooperation-ein-tina-testen-impfen-nachverfolgung-testergebnisse-und-kontaktrueckverfolgung-mit-luca-moeglich_aid-57007165","text":"Anzeige bei volksfreund.de: Luca App und Ticket i\/O gehen Kooperation ein - TINA - Testen\/Impfen\/NAchverfolgung - Testergebnisse und Kontaktr\u00fcckverfolgung mit luca m\u00f6glich"}],"scope":"Konzept","text":"","title":"ticket.io: \u201cLuca App und Ticket I\/O gehen Kooperation ein\u201d","type":"doc"},{"date":"30.03.2021","dt_created":"2021-03-30 00:00:00","dt_updated":"2021-03-30 00:00:00","embed":[{"type":"fragdenstaat","id":"217030"}],"id":"3640177e9135","id_readable":"2021-03-30_fragdenstaat_fragdenstaatde-Datenschutz-Folgenabschtzung-DSFA-fr-die-Luca-App","links":[{"url":"https:\/\/fragdenstaat.de\/a\/217030","text":"https:\/\/fragdenstaat.de\/a\/217030"}],"scope":"Land: Berlin","tags":["vertrag","datenschutz"],"text":"Pr\u00fcfverfahren dauert dran; Informationszugang ist geb\u00fchrenpflichtig","title":"fragdenstaat.de: Datenschutz-Folgenabsch\u00e4tzung (DSFA) f\u00fcr die Luca-App","type":"fragdenstaat"},{"date":"30.03.2021","dt_created":"2021-03-30 00:00:00","dt_updated":"2021-03-30 00:00:00","embed":[{"type":"fragdenstaat","id":"217046"}],"id":"cd62a5bb1783","id_readable":"2021-03-30_fragdenstaat_fragdenstaatde-Gesetzes-Datenschutz-Folgenabschtzung-DSFA-fr-die-Luca-App-gem-Art-35-10-DSGVO","links":[{"url":"https:\/\/fragdenstaat.de\/a\/217046","text":"https:\/\/fragdenstaat.de\/a\/217046"}],"tags":["vertrag","datenschutz"],"text":"","title":"fragdenstaat.de: \u201eGesetzes\u201c-Datenschutz-Folgenabsch\u00e4tzung (DSFA) f\u00fcr die Luca-App gem\u00e4\u00df Art. 35 (10) DSGVO","type":"fragdenstaat"},{"date":"31.03.2021","dt_created":"2021-03-31 00:00:00","dt_updated":"2021-03-31 00:00:00","embed":[{"type":"tweet","url":"https:\/\/twitter.com\/HonkHase\/status\/1377132479962750978"}],"id":"9db9c891242e","id_readable":"2021-03-31_incident_Schwachstelle-Alle-Gesundheitsmter-nutzen-denselben-Schlssel-zum-Zugriff-auf-Kontaktdaten","text":"Zwar rotiert dieser Schl\u00fcssel t\u00e4glich, doch kommt er in einem Gesundheitsamt abhanden (oder wird dort t\u00e4glich mitgelesen), dann sind auch alle Kontaktdaten, die f\u00fcr andere Gesundheits\u00e4mter bestimmt waren, betroffen.","title":"Schwachstelle: Alle Gesundheits\u00e4mter nutzen denselben Schl\u00fcssel zum Zugriff auf Kontaktdaten","type":"incident"},{"date":"31.03.2021","dt_created":"2021-03-31 00:00:00","dt_updated":"2021-03-31 00:00:00","embed":[{"type":"tweet","url":"https:\/\/twitter.com\/sand2drn\/status\/1377131074212425728"}],"id":"5f2855610683","id_readable":"2021-03-31_incident_Schwachstelle-Luca-Bereiche-werden-viel-zu-gro-fr-eine-sinnvolle-Kontaktnachverfolgung-dimensioniert","text":"Bspw. wird im Maximilianpark Hamm nur ein Luca-QR-Code (und somit eine \"Luca-Zone\") f\u00fcr insgesamt rund 22 Hektar genutzt.","title":"Schwachstelle: Luca-Bereiche werden viel zu gro\u00df f\u00fcr eine sinnvolle Kontaktnachverfolgung dimensioniert","type":"incident"},{"date":"31.03.2021","dt_created":"2021-03-31 00:00:00","dt_updated":"2021-03-31 00:00:00","embed":[{"type":"tweet","url":"https:\/\/twitter.com\/Wasserbombe\/status\/1377197156927422465"},{"type":"tweet","url":"https:\/\/twitter.com\/janboehm\/status\/1379564653060227072"}],"id":"c3c629b33db4","id_readable":"2021-03-31_incident_Konzept-Problem-Check-In-von-berall-mglich-QR-Codes-gengen","text":"... und die gibt's auf Social Media reichlich!","title":"Konzept-Problem: Check-In von \u00fcberall m\u00f6glich, QR-Codes gen\u00fcgen","type":"incident"},{"date":"31.03.2021","dt_created":"2021-03-31 00:00:00","dt_updated":"2021-03-31 00:00:00","embed":[{"type":"tweet","url":"https:\/\/twitter.com\/zerforschung\/status\/1376996347774177284"},{"type":"gitlab","project":"25531274","issue":"1"},{"type":"gitlab","project":"25531274","issue":"2"}],"id":"a837c6320a66","id_readable":"2021-03-31_doc_Code-teilweise-verffentlicht-sehr-eingeschrnkte-Lizenz","links":[{"url":"https:\/\/gitlab.com\/lucaapp\/android\/-\/commit\/f03c6024bf87a773d6c299b1622d76136e73e0ec","text":"Gitlab-Commit mit initialer Lizenz (gitlab.com)"},{"url":"https:\/\/gitlab.com\/lucaapp\/android\/-\/commit\/488a48fe0c23bff5f91d8c74fe1104bf21fbac73","text":"Gitlab-Commit, in dem die Lizenz durch GPLv3 ersetzt wird (gitlab.com)"},{"url":"https:\/\/netzpolitik.org\/2021\/mfg-gpl-die-fantastische-lizenz-der-luca-app\/","text":"Alexander Fanta: MfG, GPL - Die fantastische Lizenz der Luca-App (netzpolitik.org)"},{"url":"https:\/\/zerforschung.org\/posts\/luca-2\/","text":"zerforschung.org: Die Luca-Lizenz (LL-ND-NC-WTF)"}],"tags":["open-source","code","gitlab","lizenz"],"text":"Code des Luca-Systems sollte als Open Source bereitgestellt werden, wurde zun\u00e4chst aber nur mit einer \"eingeschr\u00e4nkten Lizenz\" ver\u00f6ffentlicht, die nicht einmal den Download\/das Forken des Repositories oder das Zitieren von Code-Abschnitten - und schon gar nicht Builds\/Pentests der Software - erm\u00f6glicht.<br>Nach \u00f6ffentlichem Druck durch die IT-Community wurde die - angeblich \"tempor\u00e4re\" - Lizenz durch eine wirkliche Open Source-Lizenz ersetzt (GPLv3).","title":"Code teilweise ver\u00f6ffentlicht, sehr eingeschr\u00e4nkte Lizenz","type":"doc"},{"date":"31.03.2021","dt_created":"2021-03-31 00:00:00","dt_updated":"2021-03-31 00:00:00","embed":[{"type":"gitlab","project":"25531274","issue":"3"}],"id":"caa21b35af2d","id_readable":"2021-03-31_incident_Code-und-Code-Commits-fehlen-in-Gitlab---immer-wieder","text":"","title":"Code und Code-Commits fehlen in Gitlab - immer wieder","type":"incident"},{"date":"01.04.2021","dt_created":"2021-04-01 00:00:00","dt_updated":"2021-04-01 00:00:00","embed":[{"type":"tweet","url":"https:\/\/twitter.com\/benfooben\/status\/1377191196922159108"}],"id":"bcec1342b408","id_readable":"2021-04-01_incident_Corona-Tracing-App-Luca-verletzt-Urheberrecht-von-Wiener","links":[{"url":"https:\/\/futurezone.at\/netzpolitik\/corona-tracing-app-luca-verletzt-urheberrecht-von-wiener\/401338920","text":"Barbara Wimmer: \u201cCorona-Tracing-App Luca verletzt Urheberrecht von Wiener\u201d (futurezone.at)"},{"url":"https:\/\/github.com\/thesimj\/jBaseZ85\/issues\/1","text":"benbender: \u201cCopyright infringement by \"Culture4Life GmbH\" \/ LucaApp\u201d (github.com)"}],"tags":["open-source","code","lizenz"],"text":"Die Tracing-App von Rapper Smudo hat das Urheberrecht eines Wiener Entwicklers verletzt. Der setzt jetzt rechtliche Schritte.","title":"\u201cCorona-Tracing-App Luca verletzt Urheberrecht von Wiener\u201d","type":"incident"},{"date":"04.04.2021","dt_created":"2021-04-04 00:00:00","dt_updated":"2021-04-04 00:00:00","id":"ac2075782344","id_readable":"2021-04-04_doc_Bianca-Kastl-Was-muss-eigentlich-getan-werden-damit-aus-digitalen-Tracinginformationen-Infektionen-oder-zumindest-Hinweise-darauf-erkennbar-werden","links":[{"url":"https:\/\/bkastl.de\/notes\/eine-kleine-contact-tracing-datenforensik-luca-corona-warnapp","text":"Bianca Kastl: \u201cEine kleine Contact Tracing Datenforensik: Was muss eigentlich getan werden, damit aus digitalen Tracinginformationen Infektionen oder zumindest Hinweise darauf erkennbar werden?\u201d (bkastl.de)"}],"scope":"Bundesweit","text":"","title":"Bianca Kastl: \u201cWas muss eigentlich getan werden, damit aus digitalen Tracinginformationen Infektionen oder zumindest Hinweise darauf erkennbar werden?\u201d","type":"doc","verified":true},{"date":"04.04.2021","dt_created":"2021-04-04 00:00:00","dt_updated":"2021-04-04 00:00:00","id":"5716877ab198","id_readable":"2021-04-04_incident_Schwachstelle-Beliebige-6-stellige-Zahl-funktioniert-als-TAN","links":[{"url":"https:\/\/www.nnn.de\/lokales\/rostock\/hansestadt-rostock\/Luca-App-Schluesselanhaenger-offenbart-Sicherheitsluecken-in-Rostock-id31790352.html","text":"Norddeutsche Neueste Nachrichten: Schl\u00fcsselanh\u00e4nger offenbart eklatante Sicherheitsl\u00fccken"}],"tags":["sms-tan","luca-frontend"],"text":"Impact: >20.000 Schl\u00fcsselanh\u00e4nger","title":"Schwachstelle: Beliebige 6-stellige Zahl funktioniert als TAN","type":"incident"},{"date":"05.04.2021","dt_created":"2021-04-05 00:00:00","dt_updated":"2021-04-05 00:00:00","embed":[{"type":"podlove","id":"https%3A%2F%2Flogbuch-netzpolitik.de%2F%3Fpodlove_player4%3D2036"}],"id":"f1463c943796","id_readable":"2021-04-05_podcast_Logbuch-Netzpolitik-Magisches-Denken","links":[{"url":"https:\/\/logbuch-netzpolitik.de\/lnp387-magisches-denken","text":"Logbuch Netzpolitik 387: Magisches Denken (logbuch-netzpolitik.de)"}],"text":"Ein Logbuch:Netzpolitik (LNP)-Spezial zur Luca-App und der Corona-Warn-App","title":"Logbuch Netzpolitik: Magisches Denken","type":"podcast"},{"date":"06.04.2021","dt_created":"2021-04-06 00:00:00","dt_updated":"2021-04-06 00:00:00","id":"08c71f69f106","id_readable":"2021-04-06_doc_Kleine-Anfrage-Nutzbarkeit-der-Strken-der-luca-App---Erweiterung-von-ffnungsstrategien","links":[{"url":"https:\/\/dip.bundestag.de\/vorgang\/nutzbarkeit-der-st%C3%A4rken-der-luca-app-erweiterung-von-%C3%B6ffnungsstrategien\/276094","text":"Vorgang (Deutscher Bundestag, DIP)"},{"url":"https:\/\/dserver.bundestag.de\/btd\/19\/282\/1928280.pdf","text":"BT-Drucksache 19\/28280, Kleine Anfrage Fraktion der FDP"},{"url":"https:\/\/dserver.bundestag.de\/btd\/19\/293\/1929333.pdf","text":"BT-Drucksache 19\/29333, Antwort Bundesregierung"}],"text":"","title":"Kleine Anfrage: Nutzbarkeit der St\u00e4rken der luca App - Erweiterung von \u00d6ffnungsstrategien","type":"doc"},{"date":"07.04.2021","dt_created":"2021-04-07 00:00:00","dt_updated":"2021-04-07 00:00:00","id":"5b9a47e86225","id_readable":"2021-04-07_incident_Schwachstelle-Luca-kann-in-Datenerfassung-eingreifen","links":[{"url":"https:\/\/www.berlinstory-news.de\/virtuelle-corona-party-beendet\/","text":"Enno Lenze: \u201cVirtuelle Corona-Party beendet\u201d (berlinstory-news.de)"}],"text":"Einen zentralen Kritikpunkt an der zentralen Datenspeicherung beim Luca-System f\u00fchren die Luca-Macher direkt selbst vor: Enno Lenze startet auf Twitter den Aufruf, bei seiner privaten Veranstaltung einzuchecken - die Luca-Macher beendeten bzw. l\u00f6schten die Veranstaltung bei \u00fcber 400.000 Check-Ins, wegen \"offensichtlichen Missbrauchs\". Man hatte hier also Zugriff auf Veranstaltungen und konnte die Datenerfassung von Betreiberseite aus beenden.<br>Sp\u00e4ter ruderte man zur\u00fcck und verneinte die M\u00f6glichkeit - man hatte quasi \u00fcber Nacht eine Grenze f\u00fcr die maximale Anzahl an Teilnehmern implementiert.","title":"Schwachstelle: Luca kann in Datenerfassung eingreifen","type":"incident"},{"date":"07.04.2021","dt_created":"2021-04-07 00:00:00","dt_updated":"2021-04-07 00:00:00","id":"129763282e92","id_readable":"2021-04-07_news_Einfach-grottig--dieser-Trick-entlarvt-den-fatalen-Fehler-der-Luca-App","links":[{"url":"https:\/\/www.welt.de\/wirtschaft\/plus229919373\/Luca-App-So-leicht-laesst-sich-die-Corona-Kontaktverfolgung-austricksen.html","text":"Benedikt Fuest: \u201c\u201eEinfach grottig\u201c \u2013 dieser Trick entlarvt den fatalen Fehler der Luca-App\u201d (welt.de)"}],"text":"Artikel auf welt.de","title":"\u201c\u201eEinfach grottig\u201c \u2013 dieser Trick entlarvt den fatalen Fehler der Luca-App\u201d","type":"news"},{"date":"07.04.2021","dt_created":"2021-04-07 00:00:00","dt_updated":"2021-04-07 00:00:00","embed":[{"type":"fragdenstaat","id":"217676"}],"id":"0354a53b81b0","id_readable":"2021-04-07_fragdenstaat_fragdenstaatde-Vertrag-luca-App","links":[{"url":"https:\/\/fragdenstaat.de\/a\/217676","text":"https:\/\/fragdenstaat.de\/a\/217676"}],"scope":"Stadt Weimar","tags":[],"text":"","title":"fragdenstaat.de: Vertrag luca App","type":"fragdenstaat"},{"date":"08.04.2021","dt_created":"2021-04-08 00:00:00","dt_updated":"2021-04-08 00:00:00","embed":[{"type":"tweet","url":"https:\/\/twitter.com\/AllenRe97883617\/status\/1379405366010732552"}],"id":"09b18cc500b1","id_readable":"2021-04-08_incident_Schwachstelle-Anonyme-Luca-QR-Codes-lassen-sich-ohne-Luca-erstellen-und-nutzen","links":[{"url":"https:\/\/twitter.com\/AllenRe97883617\/status\/1379405366010732552","text":"Tweet von @AllenRe97883617 (Twitter)"}],"text":"Die lokal generierten QR-Codes lassen sich vom Luca App-Scanner (f\u00fcr Gastgeber) einscannen, werden als g\u00fcltig erkannt und erh\u00f6hen den Gastz\u00e4hler beim Betreiber, sind ansonsten aber sinnlos.","title":"Schwachstelle: Anonyme Luca-QR-Codes lassen sich ohne Luca erstellen und nutzen","type":"incident"},{"date":"08.04.2021","dt_created":"2021-11-09 23:00:00","dt_updated":"2021-11-09 23:00:00","id":"eb209e94890c","id_readable":"2021-04-08_doc_Chaos-Treff-Osnabrck-Offener-Brief-an-Entscheidungstrger","links":[{"url":"https:\/\/chaostreff-osnabrueck.de\/downloads\/brief_kontaktnachverfolgungsapps.pdf","text":"Offener Brief: Wir fordern eine Anpassung der Nieders\u00e4chsischen Corona-Verordnung, um pseudonyme Kontaktlisten mittels der Corona-WarnApp zu erm\u00f6glichen (chaostreff-osnabrueck.de)"}],"text":"<blockquote>Wir fordern eine Anpassung der Nieders\u00e4chsischen Corona-Verordnung, um pseudonyme Kontaktlisten mittels der Corona-WarnApp zu erm\u00f6glichen<\/blockquote><blockquote>Wir fordern Sie auf: Setzen Sie auf das bestehende Vertrauen und auf die bestehende L\u00f6sung. Auch f\u00fcr die angestrebte L\u00f6sung muss die Verordnung angepasst werden. Machen Sie dies nachhaltig, schaffen sie Vertrauen, erm\u00f6glichen Sie die pseudonyme Erfassung von Kontaktlisten und st\u00e4rken Sie das digitale Contact Tracing!<\/blockquote>","title":"Chaos-Treff Osnabr\u00fcck: Offener Brief an Entscheidungstr\u00e4ger","type":"doc","verified":true},{"date":"08.04.2021","dt_created":"2021-04-08 00:00:00","dt_updated":"2021-04-08 00:00:00","embed":[{"type":"iframe","url":"https:\/\/rechtsbelehrung.com\/?powerpress_embed=18470-podcast&amp;powerpress_player=mediaelement-audio","height":"40px"}],"id":"4090daabf5cc","id_readable":"2021-04-08_podcast_Rechtsbelehrung-Luca--Eine-App-viele-Desaster--Rechtsbelehrung-90","links":[{"url":"https:\/\/rechtsbelehrung.com\/luca-app-rechtsbelehrung-90\/","text":"Marcus Richter und Thomas Schwenke: Luca \u2013 Eine App, viele Desaster \u2013 Rechtsbelehrung 90 (rechtsbelehrung.com)"}],"text":"","title":"Rechtsbelehrung: \u201cLuca \u2013 Eine App, viele Desaster \u2013 Rechtsbelehrung 90\u201d","type":"podcast"},{"date":"08.04.2021","dt_created":"2021-04-08 00:00:00","dt_updated":"2021-04-08 00:00:00","embed":[{"type":"youtube","id":"tGq0_04j3T4"}],"id":"9609b5d218aa","id_readable":"2021-04-08_incident_Schwachstelle-SMS-TAN-Verfahren-lsst-sich-clientseitig-umgehen","links":[],"tags":["sms-tan"],"text":"","title":"Schwachstelle: SMS-TAN-Verfahren l\u00e4sst sich clientseitig umgehen","type":"incident","verified":true},{"date":"08.04.2021","dt_created":"2021-08-25 00:00:00","dt_updated":"2021-08-25 00:00:00","embed":[{"type":"youtube","id":"kNGVQcLjlmo"}],"id":"c21b0312291b","id_readable":"2021-04-08_podcast_The-Morpheus-Vlogs-Luca-Verschlsselung-einfach-erklrt","links":[{"url":"https:\/\/www.youtube.com\/watch?v=kNGVQcLjlmo","text":"The Morpheus Vlogs: \u201cDas ist NICHT VERSCHL\u00dcSSELT, liebe LUCA APP!\u201c (youtube.com)"}],"tags":["youtube","verschl\u00fcsselung"],"text":"The Morpheus Vlogs erkl\u00e4rt auf YouTube das Verschl\u00fcsselungsprinzip hinter der Luca-App und erkl\u00e4rt, warum es sich dabei nicht um eine Verschl\u00fcsselung handelt, wie wir sie erwarten w\u00fcrden.","title":"The Morpheus Vlogs: Luca-Verschl\u00fcsselung einfach erkl\u00e4rt","type":"podcast"},{"date":"11.04.2021","dt_created":"2021-04-11 00:00:00","dt_updated":"2021-04-11 00:00:00","embed":[{"type":"fragdenstaat","id":"218014"}],"id":"cc12f08b31dd","id_readable":"2021-04-11_fragdenstaat_fragdenstaatde-Kosten-fr-den-Einsatz-der-Luca-App","links":[{"url":"https:\/\/fragdenstaat.de\/a\/218014","text":"https:\/\/fragdenstaat.de\/a\/218014"}],"scope":"Land: Rheinland-Pfalz","tags":["vertrag","kosten"],"text":"Ergebnis: Kosten in Summe, ansonsten abgelehnt.","title":"fragdenstaat.de: Kosten f\u00fcr den Einsatz der Luca-App","type":"fragdenstaat"},{"date":"11.04.2021","dt_created":"2021-04-11 00:00:00","dt_updated":"2021-04-11 00:00:00","embed":[{"type":"fragdenstaat","id":"218042"}],"id":"d20a345bd0e9","id_readable":"2021-04-11_fragdenstaat_fragdenstaatde-Einsatz-der-Luca-App-in-RLP-Modellkommunen","links":[{"url":"https:\/\/fragdenstaat.de\/a\/218042","text":"https:\/\/fragdenstaat.de\/a\/218042"}],"scope":"Land: Rheinland-Pfalz","tags":["vertrag","kosten"],"text":"Ergebnis: Abgelehnt; Informationen nicht vorhanden.","title":"fragdenstaat.de: Einsatz der Luca-App in RLP-Modellkommunen","type":"fragdenstaat"},{"date":"12.04.2021","dt_created":"2021-04-12 00:00:00","dt_updated":"2021-04-12 00:00:00","geo":{"city":"Weimar","state":"Th\u00fcringen","state_short":"TH","position":{"lat":50.98115764144089,"lng":11.32635902982103}},"id":"0a5ec94723ce","id_readable":"2021-04-12_doc_Stadt-Weimar-Studie-zum-Nutzen-der-Luca-App","links":[{"url":"https:\/\/stadt.weimar.de\/fileadmin\/redaktion\/Dokumente\/corona\/Evaluation_des_Weimarer_Modells_final_Stand20210412_1523.pdf","text":"Das Weimarer Modell: Testen \u2013 Lockern - Impfen, Evaluation der Testphase 1 (stadt.weimar.de)"}],"scope":"Stadt Weimar","tags":["weimar","studie"],"title":"Stadt Weimar: Studie zum Nutzen der Luca-App","type":"doc","verified":true},{"date":"12.04.2021","dt_created":"2021-04-12 00:00:00","dt_updated":"2021-04-12 00:00:00","embed":[{"type":"fragdenstaat","id":"216803"}],"id":"db40f283ba84","id_readable":"2021-04-12_fragdenstaat_Hessiche-Staatskanzlei-sieht-fr-die-Herausgabe-des-Vertragswerks-ein-Verfahren-bei-Beteiligung-Dritter-und-veranschlagt-Kosten-bis-zu-600","links":[],"scope":"Land: Hessen","tags":["vertrag","hessen"],"text":"","title":"Hessiche Staatskanzlei sieht f\u00fcr die Herausgabe des Vertragswerks ein \u201eVerfahren bei Beteiligung Dritter\u201c und veranschlagt Kosten bis zu 600\u20ac","type":"fragdenstaat","verified":true},{"date":"12.04.2021","dt_created":"2021-04-12 00:00:00","dt_updated":"2021-04-12 00:00:00","id":"9c0a1f179764","id_readable":"2021-04-12_incident_Schwachstelle-Luca-App-ist-nicht-barrierefrei","links":[{"url":"https:\/\/bbsb.org\/newsletter-eintrag\/bbsb-pressemitteilung-luca-app-nicht-barrierefrei-bbsb-inform-12-04-2021-2\/","text":"Bayerische Blinden- und Sehbehindertenbund e.V.: Luca-App nicht barrierefrei (bbsb.org)"}],"tags":["barrierefreiheit","bbsb"],"text":"<ul><li>Etablierte Standards f\u00fcr Barrierefreiheit in Apps wurden nicht umgesetzt<\/li><li>Nur eine barrierefreie App erm\u00f6glicht allen Menschen, diese uneingeschr\u00e4nkt zu nutzen<\/li><li>Bei der Beschaffung und Auftragsvergabe wurde nicht an Barrierefreiheit gedacht.<\/li><\/ul>","title":"Schwachstelle: Luca-App ist nicht barrierefrei","type":"incident","verified":false},{"date":"13.04.2021","dt_created":"2021-04-13 00:00:00","dt_updated":"2021-04-13 00:00:00","id":"a12de7f77282","id_readable":"2021-04-13_incident_Schwachstelle-LucaTrack-Historie-fr-Schlsselanhnger-auslesbar-damit-Bewegungsprofile-mglich","links":[{"url":"https:\/\/lucatrack.de\/","text":"lucatrack.de"},{"url":"https:\/\/bkastl.de\/notes\/luca-app-lucatrack-und-andere-gefahren","text":"Bianca Kastl: LucaTrack und andere Gefahren"}],"text":"\u00dcber Meta-Daten k\u00f6nnen seitens des Betreibers Bewegungsprofile von Nutzern erstellt<br><br>Impact: Alle Nutzer \/ private Treffen","title":"Schwachstelle: LucaTrack: Historie f\u00fcr Schl\u00fcsselanh\u00e4nger auslesbar, damit Bewegungsprofile m\u00f6glich","type":"incident"},{"date":"13.04.2021","dt_created":"2021-04-13 00:00:00","dt_updated":"2021-04-13 00:00:00","id":"1571fb87be7d","id_readable":"2021-04-13_podcast_She-likes-Tech-22---Luca-vs-Datenschutz","links":[{"url":"https:\/\/www.ndr.de\/nachrichten\/info\/22-Vertrauen-ist-keine-gute-Technologie,audio868810.html","text":"She likes Tech #22 - Luca vs. Datenschutz"},{"url":"https:\/\/www.ndr.de\/nachrichten\/info\/podcast4808.html","text":"NDR info: She Likes Tech - der Podcast \u00fcber Technologie (Gesamtseite des Podcasts)"}],"text":"","title":"She likes Tech #22 - Luca vs. Datenschutz","type":"podcast"},{"date":"13.04.2021","dt_created":"2021-04-13 00:00:00","dt_updated":"2021-04-13 00:00:00","embed":[{"type":"youtube","id":"ywldwHuZ9Ak"}],"id":"91f830bdf1f4","id_readable":"2021-04-13_incident_Schwachstelle-Tracking-of-unique-mobile-devices-and-check-in-locations-from-operator-perspective-of-LucaApp-backend","links":[{"url":"https:\/\/github.com\/mame82\/misc\/blob\/master\/cve-luca\/cve-2021-33838.md","text":"Marcus Mengs: CVE-2021-33838 (Github)"}],"text":"\u00dcber Meta-Daten k\u00f6nnen seitens des Betreibers Bewegungsprofile von Nutzern erstellt<br><br>Impact: Alle Nutzer \/ private Treffen","title":"Schwachstelle: \u201cTracking of unique mobile devices and check-in locations from operator perspective of LucaApp backend\u201d","type":"incident"},{"date":"13.04.2021","dt_created":"2021-04-13 00:00:00","dt_updated":"2021-04-13 00:00:00","id":"f50fff3fb9b0","id_readable":"2021-04-13_news_Luca-App-CCC-fordert-Bundesnotbremse","links":[{"url":"https:\/\/www.ccc.de\/de\/updates\/2021\/luca-app-ccc-fordert-bundesnotbremse","text":"Luca-App: CCC fordert Bundesnotbremse"}],"tags":["ccc","linus-neumann"],"text":"<ul><li>Investor Smudo auf Talkshow-Tour<\/li><li>Staatlich subventioniertes Gesch\u00e4ftsmodell<\/li><li>Fragw\u00fcrdige Vergabepraxis<\/li><li>Alternativen geflissentlich ignoriert<\/li><li>Zweifelhafter Nutzen<\/li><li>Betreiber greifen in zentralen Datenbestand ein<\/li><li>Handwerkliche M\u00e4ngel und Schwachstellen<\/li><\/ul>","title":"\u201cLuca-App: CCC fordert Bundesnotbremse\u201d","type":"news"},{"date":"14.04.2021","dt_created":"2021-04-14 00:00:00","dt_updated":"2021-04-14 00:00:00","id":"1cdcccd3afe8","id_readable":"2021-04-14_news_Mit-Kommerz-in-die-vierte-Welle","links":[{"url":"https:\/\/www.nd-aktuell.de\/artikel\/1150766.luca-app-mit-kommerz-in-die-vierte-welle.html","text":"Daniel L\u00fccking: \u201cMit Kommerz in die vierte Welle\u201d (nd-aktuell.de)"}],"text":"<blockquote>[...] Doch bei den Landesregierungen z\u00e4hlt technischer Sachverstand offenbar nicht. Mit kurzsichtigen und vorschnellen app-gest\u00fctzten \u00d6ffnungen droht bald eine vierte Infektionswelle.<\/blockquote>","title":"\u201cMit Kommerz in die vierte Welle\u201d","type":"news"},{"date":"14.04.2021","dt_created":"2021-04-14 00:00:00","dt_updated":"2021-04-14 00:00:00","embed":[{"type":"fragdenstaat","id":"218377"}],"geo":{"city":"Kassel","state":"Hessen","state_short":"HE","position":{"lat":51.312130189691366,"lng":9.4715920757401}},"id":"d53a3f3b5b59","id_readable":"2021-04-14_fragdenstaat_fragdenstaatde-luca-App","links":[{"url":"https:\/\/fragdenstaat.de\/a\/218377","text":"https:\/\/fragdenstaat.de\/a\/218377"}],"scope":"Kreis: Kassel","tags":[],"text":"Sowohl die Stadt Kassel als auch der Landkreis Kassel haben keinen Vertrag \u00fcber die Nutzung der Luca App abgeschlossen und es entstehen bislang auch keine Kosten. Der gesamte rechtliche Hintergrund lief \u00fcber das Hessische Ministerium f\u00fcr Soziales und Integration, Referat Gesundheitspolitik.","title":"fragdenstaat.de: luca App","type":"fragdenstaat"},{"date":"15.04.2021","dt_created":"2021-04-15 00:00:00","dt_updated":"2021-04-15 00:00:00","embed":[{"type":"tweet","url":"https:\/\/twitter.com\/ralf\/status\/1382673524276477955"}],"id":"66482359ac76","id_readable":"2021-04-15_incident_SchwachstelleProof-of-Concept-Dank-Luca-App-berall-einchecken","text":"","title":"Schwachstelle\/Proof of Concept: Dank Luca-App \u00fcberall einchecken!","type":"incident","verified":true},{"date":"19.04.2021","dt_created":"2021-04-19 00:00:00","dt_updated":"2021-04-19 00:00:00","id":"90b943d31eae","id_readable":"2021-04-19_incident_Forschungsprojekt-lucifer---Wenn-luca-zum-Teufel-geht","links":[{"url":"https:\/\/lucifer-app.de\/","text":"lucifer-app.de"},{"url":"https:\/\/gitlab.com\/luciferapp\/android\/-\/commit\/2ea74fd8949878f9d9e88fcc99432a7ccc4b95a1","text":"Gitlab-Commit: Rebranding Luca (gitlab.com)"}],"text":"lucifer-app.de stellt das Luca-System (Android-App und Web-App) nach und untersucht so, welche Daten durch Server der luca App erhoben und verkn\u00fcpft werden k\u00f6nnen, ohne dass dies durch Endnutzer feststellbar w\u00e4re. Ziel des Projektes ist es festzustellen, was passieren k\u00f6nnte, wenn die Server von luca unter Kontrolle einer Person fallen, die diese missbr\u00e4uchlich oder f\u00fcr andere Zwecke einsetzt.<br>Mithilfe einer <a href=\"https:\/\/app.lucifer-app.de\/lucifer\/\" target=\"_blank\">Suche<\/a> k\u00f6nnen erfasste Daten durchsucht werden.","title":"Forschungsprojekt: lucifer - Wenn luca zum Teufel geht","type":"incident"},{"date":"22.04.2021","dt_created":"2021-08-25 00:00:00","dt_updated":"2021-08-25 00:00:00","id":"41ab6c53df5c","id_readable":"2021-04-22_news_Zwei-Apps-sind-eine-zu-viel","links":[{"url":"https:\/\/www.nordbayern.de\/region\/forchheim\/kommentar-zwei-apps-sind-eine-zu-viel-1.11019076","text":"Max S\u00f6llner: \u201cKommentar: Zwei Apps sind eine zu viel\u201d (nordbayern.de)"}],"text":"<blockquote>Es w\u00e4re vermeidbar gewesen, dass der Staat viel Geld in eine bedenkliche App steckt, kommentiert Max S\u00f6llner.<\/blockquote>","title":"\u201cZwei Apps sind eine zu viel\u201d","type":"news"},{"date":"22.04.2021","dt_created":"2021-04-22 00:00:00","dt_updated":"2021-04-22 00:00:00","embed":[{"type":"tweet","url":"https:\/\/twitter.com\/ralf\/status\/1385331819587981319"}],"id":"f8dea63a18fe","id_readable":"2021-04-22_doc_Gesundheitsamt-Aktivittsmonitor-lucadenkenio","links":[{"url":"http:\/\/luca.denken.io\/","text":"Ralf Rottmann: luca.denken.io"}],"text":"Traces bei Luca sind \u00f6ffentlich, damit k\u00f6nnen sie gespeichert und ausgewertet werden. Ralf Rottmann hat dazu ein kleines Tool gebastelt.","title":"Gesundheitsamt-Aktivit\u00e4tsmonitor: luca.denken.io","type":"doc"},{"date":"23.04.2021","dt_created":"2021-04-23 00:00:00","dt_updated":"2021-04-23 00:00:00","embed":[{"type":"fragdenstaat","id":"219104"}],"geo":{"city":"Ennepe-Ruhr-Kreis","state":"Nordrhein-Westfalen","state_short":"NW","position":{"lat":51.338976304868176,"lng":7.29355358031557}},"id":"4fa98da44959","id_readable":"2021-04-23_fragdenstaat_fragdenstaatde-Luca-App","links":[{"url":"https:\/\/fragdenstaat.de\/a\/219104","text":"https:\/\/fragdenstaat.de\/a\/219104"}],"scope":"Kreis: Ennepe-Ruhr-Kreis","tags":[],"text":"","title":"fragdenstaat.de: Luca App","type":"fragdenstaat"},{"date":"26.04.2021","dt_created":"2021-04-26 00:00:00","dt_updated":"2021-04-26 00:00:00","embed":[{"type":"gitlab","project":"security-overview","issue":"1"},{"type":"tweet","url":"https:\/\/twitter.com\/mame82\/status\/1398312680138674180"}],"id":"0ee6ae34f5f7","id_readable":"2021-04-26_incident_Schwachstelle-Location-Betreiber-knnen-Freitextfelder-hinzufgen","text":"Dabei ist f\u00fcr Nutzer nicht ersichtlich, dass diese Felder<ul><li>nicht zur eigentlichen Datenerfassung geh\u00f6ren<\/li><li>nicht genauso verschl\u00fcsselt werden wie die eigentlichen Kontaktdaten<\/li><\/ul>","title":"Schwachstelle: Location-Betreiber k\u00f6nnen Freitextfelder hinzuf\u00fcgen","type":"incident"},{"date":"27.04.2021","dt_created":"2021-04-27 00:00:00","dt_updated":"2021-04-27 00:00:00","embed":[{"type":"fragdenstaat","id":"219344"}],"geo":{"city":"Uelzen","state":"Niedersachen","state_short":"NW","position":{"lat":52.972759385956756,"lng":10.56202162044369}},"id":"6eae0c6b110c","id_readable":"2021-04-27_fragdenstaat_fragdenstaatde-Luca-App-in-der-Stadt-Uelzen","links":[{"url":"https:\/\/fragdenstaat.de\/a\/219344","text":"https:\/\/fragdenstaat.de\/a\/219344"}],"scope":"Stadt Uelzen","tags":[],"text":"","title":"fragdenstaat.de: Luca App in der Stadt Uelzen","type":"fragdenstaat"},{"date":"28.04.2021","dt_created":"2021-04-28 00:00:00","dt_updated":"2021-04-28 00:00:00","geo":{"city":"Regensburg","state":"Bayern","state_short":"BY","position":{"lat":49.020642291469315,"lng":12.102442771716376}},"id":"9f38b379d568","id_readable":"2021-04-28_news_Luca-in-Regensburg-Digitales-Globuli","links":[{"url":"https:\/\/www.regensburg-digital.de\/luca-in-regensburg-digitales-globuli\/28042021\/","text":"Interview von Stefan Aigner mit Markus Feilner: \u201cLuca in Regensburg: Digitales Globuli\u201d (regensburg-digital.de)"},{"url":"https:\/\/www.regensburg-digital.de\/warnen-sie-ihre-buergerinnen-und-buerger-vor-der-luca-app\/12052021\/","text":"Appell an Stadtspitze und Stadtrat: \u201cWarnen Sie Ihre B\u00fcrgerinnen und B\u00fcrger vor der Luca-App\u201d (regensburg-digital.de)"}],"scope":"Stadt Regensburg","tags":["markus-feilner","interview","regensburg"],"text":"Interview mit Markus Feilner auf regensburg-digital.de","title":"\u201cLuca in Regensburg: Digitales Globuli\u201d","type":"news","verified":true},{"date":"28.04.2021","dt_created":"2021-04-28 00:00:00","dt_updated":"2021-04-28 00:00:00","embed":[{"type":"fragdenstaat","id":"219430"}],"id":"7bc297376cfd","id_readable":"2021-04-28_fragdenstaat_fragdenstaatde-Luca-App-im-Landkreis-Uelzen","links":[{"url":"https:\/\/fragdenstaat.de\/a\/219430","text":"https:\/\/fragdenstaat.de\/a\/219430"}],"scope":"Kreis: Uelzen","tags":[],"text":"","title":"fragdenstaat.de: Luca App im Landkreis Uelzen","type":"fragdenstaat"},{"date":"28.04.2021","dt_created":"2021-04-28 00:00:00","dt_updated":"2021-04-28 00:00:00","embed":[{"type":"fragdenstaat","id":"216802"}],"id":"4609b30b932e","id_readable":"2021-04-28_fragdenstaat_Sozialministerium-Baden-Wrttemberg-nennt-Luca-Kosten-verffentlicht-aber-nicht-den-Vertragt","links":[{"url":"https:\/\/fragdenstaat.de\/a\/216802","text":"https:\/\/fragdenstaat.de\/a\/216802"}],"scope":"Land: Baden-W\u00fcrttemberg","tags":["vertrag"],"text":"... aufgrund \"derzeit noch laufenden vergaberechtlichen Fristen\".","title":"Sozialministerium Baden-W\u00fcrttemberg nennt Luca-Kosten, ver\u00f6ffentlicht aber nicht den Vertragt","type":"fragdenstaat","verified":true},{"date":"28.04.2021","dt_created":"2021-04-28 00:00:00","dt_updated":"2021-04-28 00:00:00","embed":[{"type":"gitlab","project":"web","issue":"13"}],"id":"518ede66a3f6","id_readable":"2021-04-28_incident_Schwachstelle-Betreiber-knnen-sich-an-Orten-registrieren-fr-die-gar-kein-Gesundheitsamt-angebunden-ist","text":"... damit werden zwar Daten erfasst, doch kann\/wird diese niemand abrufen. Damit versto\u00dfen Betreiber gegen die vor Ort geltenden Corona-Verordnungen - m\u00f6glicherweise, ohne zu das zu wissen.","title":"Schwachstelle: Betreiber k\u00f6nnen sich an Orten registrieren, f\u00fcr die gar kein Gesundheitsamt angebunden ist.","type":"incident"},{"date":"29.04.2021","dt_created":"2021-04-29 00:00:00","dt_updated":"2021-04-29 00:00:00","embed":[{"type":"youtube","id":"jWyDfEB0m08"}],"id":"dd3265cf1720","id_readable":"2021-04-29_incident_Schwachstelle-Betreiber-QR-Codes-knnen-manipuliert-werden-um-an-Nutzerdaten-zu-gelangen","links":[{"url":"https:\/\/www.youtube.com\/watch?v=jWyDfEB0m08","text":"Luca Location Betreiber manipuliert QR code um an Nutzerdaten zu kommen (YouTube)"},{"url":"https:\/\/github.com\/mame82\/misc\/blob\/master\/cve-luca\/cve-2021-33839.md","text":"Marcus Mengs: CVE-2021-33839 (Github)"}],"text":"Impact: Alle Nutzer \/ private Treffen","title":"Schwachstelle: Betreiber-QR-Codes k\u00f6nnen manipuliert werden, um an Nutzerdaten zu gelangen","type":"incident"},{"date":"29.04.2021","dt_created":"2021-04-29 00:00:00","dt_updated":"2021-04-29 00:00:00","id":"a24e17eced39","id_readable":"2021-04-29_news_Recherche-Radio-Dreyeckland--Chaos-Computer-Club-Freiburg-Luca-wird-kaum-genutzt","links":[{"url":"https:\/\/wiki.cccfr.de\/luca_cwa_einsatz","text":"Chaos Computer Club Freiburg e.V.: Luca wird kaum genutzt (wiki.cccfr.de)"}],"text":"Nur drei Gesundheits\u00e4mter haben in den letzten 14 Tagen Luca-Abfragen durchgef\u00fchrt. So gut wie alle \u00c4mter k\u00f6nnten Luca einsetzen.","title":"Recherche Radio Dreyeckland \/ Chaos Computer Club Freiburg: Luca wird kaum genutzt","type":"news"},{"date":"29.04.2021","dt_created":"2021-04-29 00:00:00","dt_updated":"2021-04-29 00:00:00","id":"fbc288656e00","id_readable":"2021-04-29_doc_Gemeinsame-Stellungnahme-zur-digitalen-Kontaktnachverfolgung","links":[{"url":"https:\/\/digikoletter.github.io\/","text":"digikoletter.github.io"}],"text":"Gemeinsame Stellungnahme zur digitalen Kontaktnachverfolgung von \u00fcber 70 Sicherheitsforschern und \u00fcber 400 weiteren Unterzeichnern mit grundlegenden Entwicklungsprinzipien:<ul><li><b>Zweckbindung:<\/b> Das einzige Ziel muss die Pandemiebek\u00e4mpfung sein. Eine Verkn\u00fcpfung mit anderen Gesch\u00e4ftsmodellen, Anwendungsm\u00f6glichkeiten und Profitinteressen muss ausgeschlossen, idealerweise technisch unm\u00f6glich sein.<\/li><li><b>Offenheit und Transparenz:<\/b> Fachleuten, IT-Sicherheits- und Datenschutzexpert:innen muss fr\u00fchzeitig die M\u00f6glichkeit gegeben werden, sich konstruktiv am Entwicklungsprozess zu beteiligen oder diesen unabh\u00e4ngig zu begutachten.<\/li><li><b>Freiwilligkeit:<\/b> Die Nutzung bestimmter Werkzeuge zur digitalen Kontaktverfolgung muss freiwillig sein. B\u00fcrger:innen, die das Werkzeug nicht benutzen m\u00f6chten, d\u00fcrfen nicht von sozialen Aktivit\u00e4ten, dem Zutritt zu \u00f6ffentlichen Geb\u00e4uden, Gesch\u00e4ften, usw. ausgeschlossen werden.<\/li><li><b>Risikoabw\u00e4gung:<\/b> Die Beurteilung des Nutzens und der Risiken einer solchen L\u00f6sung muss im Vorfeld unabh\u00e4ngig und \u00f6ffentlich gepr\u00fcft werden k\u00f6nnen. Dies gilt ganz besonders dann, wenn der Effekt der technischen L\u00f6sung in wesentlichem Umfang auf dem Vertrauen der B\u00fcrger:innen basiert.<\/li><\/ul>","title":"Gemeinsame Stellungnahme zur digitalen Kontaktnachverfolgung","type":"doc"},{"date":"29.04.2021","dt_created":"2021-04-29 00:00:00","dt_updated":"2021-04-29 00:00:00","id":"e2cbfaed1207","id_readable":"2021-04-29_doc_Stellungnahmen-der-Konferenz-der-unabhngigen-Datenschutzaufsichtsbehrden-DSK","links":[{"url":"https:\/\/www.datenschutzkonferenz-online.de\/media\/st\/20210429_DSK_Stellungnahme_LUCA.pdf","text":"Stellungnahme zu Kontaktnachverfolgungssystemen \u2013 insbesondere zu \u201eLuca\u201c der culture4life GmbH (datenschutzkonferenz-online.de)"},{"url":"https:\/\/www.datenschutzkonferenz-online.de\/media\/pm\/20210429_PM_%20DSK_KonferenzApril.pdf","text":"Pressemitteilung: Datenschutzkonferenz \u2013 Datenschutz beim Einsatz digitaler Dienste zur Kontaktnachverfolgung (datenschutzkonferenz-online.de)"}],"text":"<ul><li>Mehrzahl der L\u00e4nder haben sich f\u00fcr Luca entschlossen, daher ist Luca Gegenstand verschiedener datenschutzaufsichtlicher Untersuchungen geworden.<\/li><li>Es ergeben sich Risiken durch den nun weiterverbreiteten Einsatz mit erh\u00f6hter Wahrscheinlichkeit von missbr\u00e4uchlicher Nutzung<\/li><li>Eingesetzte Rufnummern\u00fcberpr\u00fcfung l\u00e4sst sich umgehen und kann zur Bel\u00e4stigung von Personen missbraucht werden<\/li><li>Durch den Anbieter m\u00fcssen technische Abhilfema\u00dfnahmen umgesetzt werden.<\/li><li>Aus missbr\u00e4uchlichen Eintragungen k\u00f6nnen sich \u00dcberlastungen der Gesundheits\u00e4mter mit Daten ergeben, die f\u00fcr die Kontaktnachverfolgung nutzlos sind.<\/li><li>Nicht alle Risiken werden durch die eingesetzten zweistufigen Verschl\u00fcsselungsmechanismen vollst\u00e4ndig ausger\u00e4umt. Nach dem derzeitigen Stand kann daher ein qualifizierter Angriff von Dritten gegen die zentralen IT-Systeme des Dienstes dazu f\u00fchren, dass ab dem Zeitpunkt eines erfolgreichen Cyberangriffs die Funktionsweise des Luca-Systems manipuliert wird und im schlimmsten Fall die Angreifenden in gro\u00dfem Umfang Daten \u00fcber die Anwesenheit von Personen bei Veranstaltungen etc. entschl\u00fcsseln und ausleiten k\u00f6nnen.<\/li><\/ul>","title":"Stellungnahmen der Konferenz der unabh\u00e4ngigen Datenschutzaufsichtsbeh\u00f6rden (DSK)","type":"doc"},{"date":"02.05.2021","dt_created":"2021-05-02 00:00:00","dt_updated":"2021-05-02 00:00:00","embed":[{"type":"gitlab","issue":"2","project":"25883425"},{"type":"fragdenstaat","id":"219865"}],"id":"5e6b7c464005","id_readable":"2021-05-02_incident_Schwachstelle-Gesundheitsmter-verlieren--wechseln-Keys---ohne-dass-das-kommuniziert-wird-oder-nachvollziehbar-ist","links":[{"url":"https:\/\/fragdenstaat.de\/a\/219865","text":"fragdenstaat.de: Schl\u00fcsselzertifikate und deren \u00c4nderung bei der luca-App"}],"text":"Ralf Rottmann (<a href=\"https:\/\/luca.denken.io\" target=\"_blank\">luca.denken.io<\/a>) entdeckt etwas zun\u00e4chst unerwartetes: Gesundheits\u00e4mter \"verlieren\" \/ wechseln Keys - ohne, dass das seitens Luca oder seitens der Gesundheits\u00e4mter klar kommuniziert wird oder f\u00fcr Nutzer\/Beobachter irgendwie nachvollziehbar ist. Gleichzeitig werden Traces von Gesundheits\u00e4mtern beobachtet, die aber laut Luca API derzeit gar keinen Key besitzen. Das kann ein Zeichen daf\u00fcr sein, dass Unberechtigte auf Luca-Daten zugegriffen haben k\u00f6nnten oder im Namen eines Gesundheitsamtes Anfragen zur Freigabe der Historie bei Nutzern gestellt haben.<br><br>","title":"Schwachstelle: Gesundheits\u00e4mter \"verlieren\" \/ wechseln Keys - ohne, dass das kommuniziert wird oder nachvollziehbar ist","type":"incident"},{"date":"03.05.2021","dt_created":"2021-05-03 00:00:00","dt_updated":"2021-05-03 00:00:00","embed":[{"type":"fragdenstaat","id":"219710"}],"id":"73db9ae1df54","id_readable":"2021-05-03_fragdenstaat_fragdenstaatde-luca-App","links":[{"url":"https:\/\/fragdenstaat.de\/a\/219710","text":"https:\/\/fragdenstaat.de\/a\/219710"}],"scope":"Land: Hessen","tags":["vertrag","kosten"],"text":"Ergebnis: Kosten, \u201cVerfahren bei Beteiligung Dritter\u201d.","title":"fragdenstaat.de: luca App","type":"fragdenstaat"},{"date":"03.05.2021","dt_created":"2021-05-03 00:00:00","dt_updated":"2021-05-03 00:00:00","embed":[{"type":"fragdenstaat","id":"216804"}],"id":"98d9c8122f53","id_readable":"2021-05-03_fragdenstaat_Das-Ministerium-fr-Soziales-Gesundheit-Jugend-Familie-und-Senioren-Schleswig-Holstein-verffentlicht-Luca-Vertrag","links":[{"url":"https:\/\/fragdenstaat.de\/a\/216804","text":"https:\/\/fragdenstaat.de\/a\/216804"}],"scope":"Land: Schleswig-Holstein","tags":["vertrag"],"text":"","title":"Das Ministerium f\u00fcr Soziales, Gesundheit, Jugend, Familie und Senioren Schleswig-Holstein ver\u00f6ffentlicht Luca-Vertrag","type":"fragdenstaat","verified":true},{"date":"03.05.2021","dt_created":"2021-05-03 00:00:00","dt_updated":"2021-05-03 00:00:00","geo":{"city":"Regensburg","state":"Bayern","state_short":"BY","position":{"lat":49.010526724111976,"lng":12.05437475580781}},"id":"334c428a5cfb","id_readable":"2021-05-03_news_Luca-App-in-Regensburg-Stadtrat-kritisiert-Beschlussvorlage","links":[{"url":"https:\/\/www.regensburg-digital.de\/luca-app-in-regensburg-stadtrat-kritisiert-beschlussvorlage\/03052021\/","text":"Stefan Aigner: \u201cLuca-App in Regensburg: Stadtrat kritisiert Beschlussvorlage\u201d (regensburg-digital.de)"}],"scope":"Stadt Regensburg","tags":["cwa","regensburg"],"text":"\u201eCorona-Warn-App ist die smartere L\u00f6sung\u201c","title":"\u201cLuca-App in Regensburg: Stadtrat kritisiert Beschlussvorlage\u201d","type":"news","verified":true},{"date":"03.05.2021","dt_created":"2021-05-03 00:00:00","dt_updated":"2021-05-03 00:00:00","embed":[{"type":"fragdenstaat","id":"219744"}],"id":"0e0e44abfbee","id_readable":"2021-05-03_fragdenstaat_fragdenstaatde-Fragen-zur-Luca-App-und-Zweifel-am-Nutzen-und-der-Verhltnismigkeit-dessen-Einsatzes","links":[{"url":"https:\/\/fragdenstaat.de\/a\/219744","text":"https:\/\/fragdenstaat.de\/a\/219744"}],"scope":"Land: Bayern","tags":["vertrag","kosten"],"text":"Ergebnis: Keine Anfrage gem\u00e4\u00df BayDSG, Begr\u00fcndung mehr IF-Anfrage nicht m\u00f6glich.","title":"fragdenstaat.de: Fragen zur Luca App und Zweifel am Nutzen und der Verh\u00e4ltnism\u00e4\u00dfigkeit dessen Einsatzes","type":"fragdenstaat"},{"date":"03.05.2021","dt_created":"2021-05-03 00:00:00","dt_updated":"2021-05-03 00:00:00","id":"3e9edd290b59","id_readable":"2021-05-03_news_Bei-Luca-zahlen-wir-fr-ein-Jahr-Millionen-und-haben-danach-gar-nichts","links":[{"url":"https:\/\/www.sueddeutsche.de\/wirtschaft\/luca-app-gesundheitsamt-berlin-neukoelln-datenschutz-1.5378628","text":"Jannis Br\u00fchl (SZ): \u201cSoftware gegen Covid-19: \"Bei Luca zahlen wir f\u00fcr ein Jahr Millionen und haben danach gar nichts\"\u201d (sueddeutsche.de)"}],"scope":"Bundesweit","text":"Interview mit Linus Neumann vom Chaos Computer Club e.V. in der S\u00fcddeutschen Zeitung (volles Interview siehe unten):<blockquote>Mit der Luca-App bevorzugen viele Bundesl\u00e4nder eine L\u00f6sung, die erstens die Aufgabe ineffizienter erf\u00fcllt als andere Apps, und auch noch riskant ist. Als w\u00fcrde man nukleare Braunkohlekraftwerke bauen - es gibt keinen Grund, das zu machen.<\/blockquote><blockquote>Wenn das Bundesgesundheitsministerium f\u00fcr viele Millionen Euro eine App baut, dann ist es doch ein Unding, dass dieses Ministerium noch einen Markt f\u00fcr mehrere privatwirtschaftliche Produkte entstehen l\u00e4sst.<\/blockquote><blockquote>Man sagt also: \"Wir haben 'ne super App, die hat Millionen gekostet - aber deine Adresse musst du trotzdem noch in diesem zweiten System hier lassen.\"<\/blockquote><div class=\"quote-origin\">\u2014 Linus Neumann, Chaos Computer Club e.V.<\/div>","title":"\u201cBei Luca zahlen wir f\u00fcr ein Jahr Millionen und haben danach gar nichts\u201d","type":"news","verified":true},{"date":"04.05.2021","dt_created":"2021-05-04 00:00:00","dt_updated":"2021-05-04 00:00:00","id":"0e6918780554","id_readable":"2021-05-04_incident_Schwachstelle-Fremde-Menschen-knnen-beliebig-eingecheckt-werden","links":[{"url":"https:\/\/www.n-tv.de\/panorama\/Wurde-die-Luca-App-gehackt-article22531735.html","text":"n-tv.de: Ministerpr\u00e4sidenten eingecheckt - Wurde die Luca-App gehackt?"},{"url":"https:\/\/luci-app.de\/","text":"luci-app.de"}],"text":"Das Peng-Kollektiv zeigt mit seiner Webseite <a href=\"https:\/\/luci-app.de\/\" target=\"_blank\">luci-app.de<\/a> anschaulich, dass jeder von jedermann \u00fcberall eingecheckt werden kann, solange die Location-ID einer Location vorliegt (QR-Code). Sp\u00e4testens hier wird Luca auch zur Gefahr auf f\u00fcr die Menschen, die gar nicht Luca nutzen. Jemand kann ihre Daten verwenden und sie an einem Ort einchecken, es ist nicht m\u00f6glich herauszufinden, ob sie es wirklich waren.<br><br>Impact: Alle Menschen, auch Nicht-Luca-Nutzer","title":"Schwachstelle: Fremde Menschen k\u00f6nnen beliebig eingecheckt werden.","type":"incident"},{"date":"04.05.2021","dt_created":"2021-05-04 00:00:00","dt_updated":"2021-05-04 00:00:00","id":"ec33f2fb0b75","id_readable":"2021-05-04_news_Was-bringt-die-Luca-App-den-Gesundheitsmtern-wirklich","links":[{"url":"https:\/\/www.zeit.de\/digital\/datenschutz\/2021-04\/luca-app-gesundheitsaemter-corona-kontaktverfolgung-hackerangriff-risiko\/komplettansicht","text":"Eva Wolfangel: Luca-App - Was bringt die Luca-App den Gesundheits\u00e4mtern wirklich? (zeit.de)"},{"url":"https:\/\/stadt.weimar.de\/fileadmin\/redaktion\/Dokumente\/corona\/Evaluation_des_Weimarer_Modells_final_Stand20210412_1523.pdf","text":"Das Weimarer Modell: Testen - Lockern - Impfen, Evaluation der Testphase 1 (stadt.weimar.de)"},{"url":"https:\/\/www.datenschutzkonferenz-online.de\/media\/st\/20210429_DSK_Stellungnahme_LUCA.pdf","text":"Stellungnahme der Konferenz der unabh\u00e4ngigen Datenschutzaufsichtsbeh\u00f6rden des Bundes und der L\u00e4nder vom 29. April 2021 zu Kontaktnachverfolgungssystemen (datenschutzkonferenz-online.de)"}],"tags":["zeit","eva-wolfangel","weimar","evaluation","bodenseekreis"],"text":"<blockquote>Die Auswertung eines Modellversuchs aus Weimar legt au\u00dferdem nahe, dass von Luca bislang vor allem Daten bereitgestellt werden, mit denen Gesundheits\u00e4mter nichts anfangen k\u00f6nnen. Im Evaluierungsbericht hei\u00dft es \u00fcber den dortigen Luca-Einsatz: \"Nach erster Beurteilung durch das Gesundheitsamt waren <b>von 655 angefragten und \u00fcbermittelten Kontakten im Projektzeitraum null Kontakte relevant<\/b>.\" Auch die Datenschutzbeauftragten der L\u00e4nder und des Bundes warnten vergangene Woche in einer Stellungnahme zur Luca-App, dass diese Daten liefern k\u00f6nne, \"die f\u00fcr die Kontaktnachverfolgung nutzlos sind\".<\/blockquote>","title":"\u201cWas bringt die Luca-App den Gesundheits\u00e4mtern wirklich?\u201d","type":"news"},{"date":"04.05.2021","dt_created":"2021-05-04 00:00:00","dt_updated":"2021-05-04 00:00:00","id":"8c8ef0209e2c","id_readable":"2021-05-04_news_Sachsen-ermglicht-als-erstes-Bundesland-Corona-Warn-App-zur-Kontaktnachverfolgung","links":[{"url":"https:\/\/denken.io\/2021\/05\/04\/sachsen-ermoglicht-als-erstes-bundesland-corona-warn-app-zur-kontaktnachverfolgung\/","text":"Ralf Rottmann: Sachsen erm\u00f6glicht als erstes Bundesland Corona-Warn-App zur Kontaktnachverfolgung"},{"url":"https:\/\/www.medienservice.sachsen.de\/medien\/news\/250995","text":"sachsen.de: \u201cKabinett beschlie\u00dft neue Corona-Schutz-Verordnung\u201d"}],"text":"Sachsen erm\u00f6glicht als erstes Bundesland Corona-Warn-App zur Kontaktnachverfolgung","title":"Sachsen erm\u00f6glicht als erstes Bundesland Corona-Warn-App zur Kontaktnachverfolgung","type":"news"},{"date":"05.05.2021","dt_created":"2021-05-05 00:00:00","dt_updated":"2021-05-05 00:00:00","embed":[{"type":"bundestag-webtv","id":"7519454"}],"geo":{"city":"Berlin","state":"Berlin","state_short":"BE","position":{"lat":52.518626354430204,"lng":13.376056974000214}},"id":"81680a59a2b2","id_readable":"2021-05-05_event_Deutscher-Bundestag--Ausschuss-Digitale-Agenda-Wie-es-um-Sicherheit-und-Nutzen-von-Clustererkennungs-Apps-steht","links":[{"url":"https:\/\/www.bundestag.de\/dokumente\/textarchiv\/2021\/kw18-pa-digitale-agenda-cluster-838094","text":"Textarchiv Deutscher Bundestag: Wie es um Sicherheit und Nutzen von Clusterer\u00adkennungs-Apps steht"}],"tags":["bundestag","linus-neumann","bianca-kastl","digitale-agenda"],"text":"Der Ausschuss Digitale Agenda unter Leitung von Manuel H\u00f6ferlin (FDP) hat sich am Mittwoch, 5. Mai 2021, in einem \u00f6ffentlichen Fachgespr\u00e4ch mit der Sicherheit und Koordinierung der Nutzung von sogenannten Clustererkennungs-Apps wie der Corona-Warn-App der Bundesregierung (CWA) oder der Luca-App besch\u00e4ftigt. Die Luca-App wird bereits in einigen Bundesl\u00e4ndern zur Kontaktnachverfolgung eingesetzt, war aber zuletzt wegen Datenschutzm\u00e4ngeln in die Kritik geraten.","title":"Deutscher Bundestag \/ Ausschuss Digitale Agenda: Wie es um Sicherheit und Nutzen von Clusterer\u00adkennungs-Apps steht","type":"event"},{"date":"05.05.2021","dt_created":"2021-05-05 00:00:00","dt_updated":"2021-05-05 00:00:00","embed":[{"type":"fragdenstaat","id":"217273"}],"geo":{"city":"Suhl","state":"Th\u00fcringen","state_short":"TH","position":{"lat":50.609053456031276,"lng":10.69413194801157}},"id":"fbbf62a19fa0","id_readable":"2021-05-05_fragdenstaat_Stadt-Suhl-Upload-des-Vertrags-wegen-Vertraulichkeitsklausel-nicht-mglich","links":[],"scope":"Stadt: Suhl","text":"Die Stadt Suhl kann den Vertrag nicht uploaden, da mit dem Vertragspartner eine entsprechende Vertraulichkeitsklausel geschlossen wurde.","title":"Stadt Suhl: Upload des Vertrags wegen Vertraulichkeitsklausel nicht m\u00f6glich","type":"fragdenstaat"},{"date":"05.05.2021","dt_created":"2021-05-05 00:00:00","dt_updated":"2021-05-05 00:00:00","embed":[{"type":"youtube","id":"b_jzjQSBUZo"}],"id":"e63b31678709","id_readable":"2021-05-05_podcast_Anke-Domscheit-Berg-Ausschussreport-Hopp-oder-Topp-Luca-und-Corona-Warn-App-auf-dem-Prfstand-Video","text":"","title":"Anke Domscheit-Berg: \u201cAusschussreport: Hopp oder Topp? Luca und Corona-Warn-App auf dem Pr\u00fcfstand\u201d (Video)","type":"podcast"},{"date":"06.05.2021","dt_created":"2021-05-06 00:00:00","dt_updated":"2021-05-06 00:00:00","embed":[{"type":"ccc-media","id":"cccs-202105-lucatrack-und-andere-gefahren"}],"id":"9c331c7e51cf","id_readable":"2021-05-06_talk_Bianca-Kastl-Die-Luca-App---LucaTrack-und-andere-Gefahren","links":[{"url":"https:\/\/media.ccc.de\/v\/cccs-202105-lucatrack-und-andere-gefahren","text":"Talk auf media.ccc.de"},{"url":"https:\/\/bkastl.de\/notes\/luca-app-lucatrack-und-andere-gefahren","text":"bkastl.de: Notes"},{"url":"https:\/\/bkastl.de\/luca_lucatrack_itsec\/","text":"bkastl.de: Slides"}],"tags":["luca-badges","lucatrack","bianca-kastl"],"text":"Talk von Bianca Kastl, IT-Projektmanagerin beim Gesundheitsamt Bodenseekreis, \u00fcber die Luca-App, deren Sicherheitsprobleme und Contact-Tracing allgemein.<blockquote>Luca ist ein arg seltsames Pseudo-Open-Source-Projekt geworden, bei dem eine Community aus Gesundheits\u00e4mtern und Security Expert:innen einem Privatunternehmen dabei helfen muss, seine hohen Marketingversprechen irgendwie einl\u00f6sen zu k\u00f6nnen und daf\u00fcr Lizenzen zu kassieren.<\/blockquote>","title":"Bianca Kastl: Die Luca App - LucaTrack und andere Gefahren","type":"talk","verified":true},{"date":"07.05.2021","dt_created":"2021-05-07 00:00:00","dt_updated":"2021-08-25 19:45:00","geo":{"city":"N\u00fcrnberg","state":"Bayern","state_short":"BY","position":{"lat":49.458298407666945,"lng":11.085696011056541}},"id":"c454d09ce0fc","id_readable":"2021-05-07_news_Nrnberg-Nrnberg-hlt-an-Luca-App-fest---und-uert-sich-zur-Dauer-Kritik","links":[{"url":"https:\/\/www.nordbayern.de\/region\/nuernberg\/nurnberg-halt-an-luca-app-fest-und-aussert-sich-zur-dauer-kritik-1.11049283","text":"\u201cN\u00fcrnberg h\u00e4lt an Luca-App fest - und \u00e4u\u00dfert sich zur Dauer-Kritik\u201d (nordbayern.de)"},{"url":"https:\/\/www.nordbayern.de\/region\/nuernberg\/wieso-setzt-der-staat-auf-die-fragwurdige-luca-app-ein-kommentar-1.11055383","text":"Max S\u00f6llner: \u201cWieso setzt der Staat auf die fragw\u00fcrdige Luca-App? Ein Kommentar\u201d (nordbayern.de)"}],"scope":"Stadt: N\u00fcrnberg","text":"Artikel auf nordbayern.de","title":"N\u00fcrnberg: \u201cN\u00fcrnberg h\u00e4lt an Luca-App fest - und \u00e4u\u00dfert sich zur Dauer-Kritik\u201d","type":"news"},{"date":"10.05.2021","dt_created":"2021-05-10 00:00:00","dt_updated":"2021-05-10 00:00:00","embed":[{"type":"fragdenstaat","id":"220127"}],"geo":{"city":"Osnabr\u00fcck","state":"Niedersachen","state_short":"NS","position":{"lat":52.27689811311533,"lng":8.047598303135276}},"id":"1fed7ac519e7","id_readable":"2021-05-10_fragdenstaat_fragdenstaatde-Einsatz-der-Luca-App","links":[{"url":"https:\/\/fragdenstaat.de\/a\/220127","text":"https:\/\/fragdenstaat.de\/a\/220127"}],"scope":"Stadt Osnabr\u00fcck","tags":["vertrag","kosten","tracing-anfragen","nutzen","luca-badges"],"text":"Ergebnis: Keine Kosten f\u00fcr IT; Keine Daten \u00fcber Luca abgefragt; Schl\u00fcsselanh\u00e4nger wurden vom Citymarketing beschafft.","title":"fragdenstaat.de: Einsatz der Luca-App","type":"fragdenstaat"},{"date":"11.05.2021","dt_created":"2021-05-11 00:00:00","dt_updated":"2021-05-11 00:00:00","embed":[{"type":"tweet","url":"https:\/\/twitter.com\/mame82\/status\/1392139239165419522"},{"type":"gitlab","project":"web","issue":"15"}],"id":"c04f1f130c78","id_readable":"2021-05-11_incident_Schwachstelle-Schlsselanhnger-knnen-nicht-entschlsselt-werden","links":[{"url":"https:\/\/twitter.com\/mame82\/status\/1392139239165419522","text":"Tweet Marcus Mengs (Twitter)"}],"tags":["luca-badges"],"text":"Impact: Mehrere tausend v3-Schl\u00fcsselanh\u00e4nger und deren Nutzer, alle Gesundheits\u00e4mter","title":"Schwachstelle: Schl\u00fcsselanh\u00e4nger k\u00f6nnen nicht entschl\u00fcsselt werden.","type":"incident"},{"date":"12.05.2021","dt_created":"2021-05-12 00:00:00","dt_updated":"2021-05-12 00:00:00","id":"9e699ac0c938","id_readable":"2021-05-12_news_Appell-an-Stadtspitze-und-Stadtrat-Warnen-Sie-Ihre-Brgerinnen-und-Brger-vor-der-Luca-App","links":[{"url":"https:\/\/www.regensburg-digital.de\/warnen-sie-ihre-buergerinnen-und-buerger-vor-der-luca-app\/12052021\/","text":"regensburg-digital.de"}],"tags":["zeit","markus-feilner","regensburg"],"text":"","title":"Appell an Stadtspitze und Stadtrat: \u201cWarnen Sie Ihre B\u00fcrgerinnen und B\u00fcrger vor der Luca-App\u201d","type":"news"},{"date":"14.05.2021","dt_created":"2021-05-14 00:00:00","dt_updated":"2021-05-14 00:00:00","embed":[{"type":"tweet","url":"https:\/\/twitter.com\/evawolfangel\/status\/1393204222146064389"}],"id":"12c5a394378f","id_readable":"2021-05-14_incident_Schwachstelle-Nexenio-hat-Zugriff-auf-Seriennummer-der-Schlsselanhnger---und-damit-auf-das-Bewegungsprofil-von-Nutzern","links":[{"url":"https:\/\/twitter.com\/evawolfangel\/status\/1393204222146064389","text":"Tweet Eva Wolfangel (Twitter)"},{"url":"https:\/\/twitter.com\/cccfr\/status\/1393278132338241536","text":"Chaos Computer Club Freiburg e.V."},{"url":"https:\/\/gitlab.com\/lucaapp\/web\/-\/issues\/15","text":"Gitlab: Temporary unable to retrieve badge history"}],"tags":["luca-badges"],"text":"Eva Wolfangel: Nexenio hat offenbar Zugriff auf die Seriennummer der Schl\u00fcsselanh\u00e4nger und damit auch auf das Bewegungsprofil deren Nutzer","title":"Schwachstelle: Nexenio hat Zugriff auf Seriennummer der Schl\u00fcsselanh\u00e4nger - und damit auf das Bewegungsprofil von Nutzern","type":"incident"},{"date":"14.05.2021","dt_created":"2021-05-14 00:00:00","dt_updated":"2021-05-14 00:00:00","embed":[{"type":"tweet","url":"https:\/\/twitter.com\/mame82\/status\/1393182733673848833"},{"type":"gitlab","project":"web","issue":"16"}],"id":"28f853c80d75","id_readable":"2021-05-14_incident_Schwachstelle-Fremde-Schlsselanhnger-lassen-sich-einchecken-Kontaktdaten-fr-das-Gesundheitsamt-vernderbar---auch-nachtrglich","links":[{"url":"https:\/\/twitter.com\/mame82\/status\/1393182733673848833","text":"Tweet Marcus Mengs (Twitter)"}],"tags":["luca-badges"],"text":"Impact: Mehrere tausend Schl\u00fcsselanh\u00e4nger und deren Nutzer, alle Gesundheits\u00e4mter","title":"Schwachstelle: Fremde Schl\u00fcsselanh\u00e4nger lassen sich einchecken, Kontaktdaten f\u00fcr das Gesundheitsamt ver\u00e4nderbar - auch nachtr\u00e4glich.","type":"incident"},{"date":"15.05.2021","dt_created":"2021-05-15 00:00:00","dt_updated":"2021-05-15 00:00:00","embed":[{"type":"fragdenstaat","id":"220461"}],"id":"7cca869863c1","id_readable":"2021-05-15_fragdenstaat_fragdenstaatde-Kosten-fr-die-Luca-App","links":[{"url":"https:\/\/fragdenstaat.de\/a\/220461","text":"https:\/\/fragdenstaat.de\/a\/220461"}],"scope":"Bundesweit","tags":["vertrag","kosten","kosten\u00fcbernahme","bmg","bmf"],"text":"Ergebnis: BMG und BMF pr\u00fcfen Form der Unterst\u00fctzung \u201cder zwischenzeitlich von ihnen mehrheitlich gew\u00e4hlten Systeme\u201d.","title":"fragdenstaat.de: Kosten f\u00fcr die Luca App","type":"fragdenstaat"},{"date":"15.05.2021","dt_created":"2021-05-15 00:00:00","dt_updated":"2021-05-15 00:00:00","embed":[{"type":"fragdenstaat","id":"220462"}],"id":"47b21b7cedf9","id_readable":"2021-05-15_fragdenstaat_fragdenstaatde-Kostenbernahme-fr-die-Luca-App-Vertrag","links":[{"url":"https:\/\/fragdenstaat.de\/a\/220462","text":"https:\/\/fragdenstaat.de\/a\/220462"}],"scope":"Land: Baden-W\u00fcrttemberg","tags":["vertrag","kosten","kosten\u00fcbernahme"],"text":"","title":"fragdenstaat.de: Kosten\u00fcbernahme f\u00fcr die Luca App Vertrag","type":"fragdenstaat"},{"date":"16.05.2021","dt_created":"2021-05-16 00:00:00","dt_updated":"2021-05-16 00:00:00","embed":[{"type":"fragdenstaat","id":"220486"}],"id":"4b44a3c69542","id_readable":"2021-05-16_fragdenstaat_fragdenstaatde-Luca-App","links":[{"url":"https:\/\/fragdenstaat.de\/a\/220486","text":"https:\/\/fragdenstaat.de\/a\/220486"}],"scope":"Kreis: Soest","tags":[],"text":"","title":"fragdenstaat.de: Luca App","type":"fragdenstaat"},{"date":"17.05.2021","dt_created":"2021-05-17 00:00:00","dt_updated":"2021-05-17 00:00:00","embed":[{"type":"fragdenstaat","id":"220506"}],"id":"69d05b4bf652","id_readable":"2021-05-17_fragdenstaat_fragdenstaatde-Luca-App-im-Rhein-Neckar-Kreis","links":[{"url":"https:\/\/fragdenstaat.de\/a\/220506","text":"https:\/\/fragdenstaat.de\/a\/220506"}],"scope":"Kreis: Rhein-Neckar-Kreis","tags":[],"text":"R\u00fcckmeldung bisher: Die Entscheidung f\u00fcr den Einsatz der Luca-App beruht alleine auf der Stellungnahme des LfDi vom 02.03.2021 (!).","title":"fragdenstaat.de: Luca-App im Rhein-Neckar-Kreis","type":"fragdenstaat"},{"date":"17.05.2021","dt_created":"2021-05-17 00:00:00","dt_updated":"2021-05-17 00:00:00","embed":[{"type":"fragdenstaat","id":"220566"}],"id":"6b767b31442a","id_readable":"2021-05-17_fragdenstaat_fragdenstaat-Stellungnahme-der-culture4life-GmbH-zur-Anfrage-Vereinbarung-mit-Luca-App","links":[{"url":"https:\/\/fragdenstaat.de\/a\/220566","text":"fragdenstaat.de: Stellungnahme der culture4life GmbH zur Anfrage \"Vereinbarung mit Luca App\""}],"text":"","title":"fragdenstaat: Stellungnahme der culture4life GmbH zur Anfrage \"Vereinbarung mit Luca App\"","type":"fragdenstaat"},{"date":"19.05.2021","dt_created":"2021-05-19 00:00:00","dt_updated":"2021-05-19 00:00:00","embed":[{"type":"tweet","url":"https:\/\/twitter.com\/mame82\/status\/1394957601071370240"}],"id":"67f7160ce8df","id_readable":"2021-05-19_incident_Schwachstelle-Verffentlichte-QR-Code-Badges-offenbar-nicht-entvalidiert","links":[{"url":"https:\/\/twitter.com\/mame82\/status\/1394957601071370240","text":"Tweet Marcus Mengs (Twitter)"}],"tags":["luca-badges"],"text":"","title":"Schwachstelle: Ver\u00f6ffentlichte QR-Code-Badges offenbar nicht \u201centvalidiert\u201d","type":"incident"},{"date":"20.05.2021","dt_created":"2021-05-20 00:00:00","dt_updated":"2021-05-20 00:00:00","geo":{"city":"Regensburg","state":"Bayern","state_short":"BY","position":{"lat":49.000981731902534,"lng":12.18307719141348}},"id":"0862634bbe6a","id_readable":"2021-05-20_news_Regensburg-geht-auf-Distanz-zur-Luca-App","links":[{"url":"https:\/\/www.regensburg-digital.de\/regensburg-geht-auf-distanz-zur-luca-app\/20052021\/","text":"Stefan Aigner: \u201cRegensburg geht auf Distanz zur Luca-App\u201d (regensburg-digital.de)"}],"scope":"Stadt Regensburg","tags":["cwa","regensburg"],"text":"<blockquote>Von der viertgr\u00f6\u00dften Stadt in Bayern gibt es keine Empfehlung und schon gar keine Verpflichtung zur Nutzung der Luca-App. Das hat Regensburgs Oberb\u00fcrgermeisterin Gertrud Maltz-Schwarzfischer in einer Sitzung des Kulturausschusses am Dienstag klargestellt.<\/blockquote>","title":"\u201cRegensburg geht auf Distanz zur Luca-App\u201d","type":"news","verified":true},{"date":"26.05.2021","dt_created":"2021-05-26 00:00:00","dt_updated":"2021-05-26 00:00:00","embed":[{"type":"vimeo","id":"558459255"}],"id":"5fa5ce04b762","id_readable":"2021-05-26_incident_Schwachstelle-Remote-Code-Injection-via-CSV-Export","links":[{"url":"https:\/\/github.com\/mame82\/misc\/blob\/master\/cve-luca\/cve-2021-33840.md","text":"Marcus Mengs: CVE-2021-33840 (Github)"},{"url":"https:\/\/vimeo.com\/558459255","text":"Vimeo: Nutzer greift Gesundheitsamt an und stiehlt Daten bevor er Ransomware schickt"},{"url":"https:\/\/netzpolitik.org\/2021\/it-sicherheit-schon-wieder-desastroese-sicherheitsluecke-in-luca-app\/","text":"Markus Reuter: IT-Sicherheit - Schon wieder desastr\u00f6se Sicherheitsl\u00fccke in Luca App (netzpolitik.org)"}],"text":"Durch von Luca erfasste Kontaktdaten l\u00e4sst sich Code bei Gesundheits\u00e4mtern einschleu\u00dfen und ausf\u00fchren, wodurch Daten unbemerkt gestohlen und bearbeitet werden k\u00f6nnen.<br><br>Marcus Mengs<br><br>CVE-2021-?????<br>Impact: Alle Gesundheits\u00e4mter, alle erfasste Kontaktdaten","title":"Schwachstelle: Remote Code Injection via CSV-Export","type":"incident","verified":true},{"date":"26.05.2021","dt_created":"2021-05-26 00:00:00","dt_updated":"2021-05-26 00:00:00","embed":[{"type":"tweet","url":"https:\/\/twitter.com\/evawolfangel\/status\/1397454150875615233"}],"id":"b2a6df93402a","id_readable":"2021-05-26_news_Hacker-knnen-Gesundheitsmter-ber-Luca-angreifen","links":[{"url":"https:\/\/www.zeit.de\/digital\/2021-05\/luca-app-gesundheitsaemter-hackerangriff-risiko-kontaktverfolgung-coronavirus\/komplettansicht","text":"Eva Wolfangel: Luca-App - Hacker k\u00f6nnen Gesundheits\u00e4mter \u00fcber Luca angreifen (zeit.de)"}],"tags":["zeit","eva-wolfangel"],"text":"<blockquote>Die Luca-App liefert Daten ans Gesundheitsamt. Sicherheitsexperten zeigen nun: Darin l\u00e4sst sich Quellcode verstecken, der potenziell ganze Beh\u00f6rden lahmlegen k\u00f6nnte.<\/blockquote>","title":"\u201cHacker k\u00f6nnen Gesundheits\u00e4mter \u00fcber Luca angreifen\u201d","type":"news"},{"date":"26.05.2021","dt_created":"2021-05-26 00:00:00","dt_updated":"2021-05-26 00:00:00","embed":[{"type":"tweet","url":"https:\/\/twitter.com\/Wasserbombe\/status\/1397600383804092417"},{"type":"tweet","url":"https:\/\/twitter.com\/Linuzifer\/status\/1397516284158427136"},{"type":"gitlab","project":"25883425","issue":"3"},{"type":"gitlab","project":"web","issue":"18"},{"type":"gitlab","project":"web","issue":"20"}],"id":"19e25d7b6697","id_readable":"2021-05-26_incident_Luca-lt-CSV-Injection-Problem---halbherzig","text":"Alles, was keine Buchstaben von A-Z und Umlaute sind, wird nun ausgefiltert. Das betrifft auch E-Mail-Adressen (@) und Telefonnummern (+49). Zus\u00e4tzlich werden Wortteile wie 'FROM', d.h. z.B. im Nachnamen 'Fromm' entfernt; es wird nicht einmal mit Wortgrenzen (\\b) gearbeitet.<br>Die exportierten Daten sind f\u00fcr Gesundheits\u00e4mter somit fehlerhaft bzw. zerst\u00fcckelt bis komplett unbrauchbar.<br><br>Das Probleme wurde einige Tage sp\u00e4ter wieder behoben, indem zus\u00e4tzliche Zeichen erlaubt wurden.<br><br>Die Antwort von Luca: Alle sind schuld, au\u00dfer Luca.","title":"Luca l\u00f6\u00dft CSV-Injection-Problem - halbherzig","type":"incident"},{"date":"27.05.2021","dt_created":"2021-05-27 00:00:00","dt_updated":"2021-05-27 00:00:00","embed":[{"type":"fragdenstaat","id":"221163"}],"id":"6e02cc2b534d","id_readable":"2021-05-27_fragdenstaat_fragdenstaatde-luca-Standorte-im-Saarland","links":[{"url":"https:\/\/fragdenstaat.de\/a\/221163","text":"https:\/\/fragdenstaat.de\/a\/221163"}],"scope":"Land: Saarland","tags":[],"text":"","title":"fragdenstaat.de: luca Standorte im Saarland","type":"fragdenstaat"},{"date":"27.05.2021","dt_created":"2021-05-27 00:00:00","dt_updated":"2021-05-27 00:00:00","embed":[{"type":"vimeo","id":"558459255"}],"id":"656a983efcf7","id_readable":"2021-05-27_incident_Schwachstelle-Denial-of-Service-Angriffe-mit-eingegebenen-Nutzerdaten","links":[{"url":"https:\/\/github.com\/mame82\/misc\/blob\/master\/cve-luca\/cve-2021-33840.md","text":"Marcus Mengs: CVE-2021-33840 (Github)"},{"url":"https:\/\/vimeo.com\/558459255","text":"Vimeo: Nutzer greift Gesundheitsamt an und stiehlt Daten bevor er Ransomware schickt"},{"url":"https:\/\/t3n.de\/news\/sicherheitsluecke-kriminelle-1380790\/","text":"Kathrin Stoll: \u201cSicherheitsl\u00fccke bei Luca-App: \u00dcberarbeitung f\u00fchrt offenbar zu anderen Problemen\u201d (t3n.de)"}],"tags":["denial-of-service","ransomware","cve"],"text":"Durch von Luca erfasste Nutzerdaten l\u00e4sst sich Code bei Gesundheits\u00e4mtern einschleu\u00dfen und ausf\u00fchren. In der Gezeigten Demo wurde Ransomware eingeschleu\u00dft und das simulierte Gesundheitsamt auf diese Weise lahmgelegt.<br><br>Marcus Mengs<br><br>CVE-2021-?????<br>Impact: Alle Gesundheits\u00e4mter, alle erfasste Kontaktdaten","title":"Schwachstelle: Denial-of-Service Angriffe mit eingegebenen Nutzerdaten","type":"incident","verified":true},{"date":"28.05.2021","dt_created":"2021-05-28 00:00:00","dt_updated":"2021-05-28 00:00:00","embed":[{"type":"podlove","id":"https%3A%2F%2Flogbuch-netzpolitik.de%2F%3Fpodlove_player4%3D2048"}],"id":"625fb19274bf","id_readable":"2021-05-28_podcast_Logbuch-Netzpolitik-Hochsicherheit-kommt-vor-dem-Fall","links":[{"url":"https:\/\/logbuch-netzpolitik.de\/lnp396-hochsicherheit-kommt-vor-dem-fall","text":"Logbuch Netzpolitik 396: Hochsicherheit kommt vor dem Fall (logbuch-netzpolitik.de)"}],"text":"Ein Logbuch:Netzpolitik (LNP)-Spezial zur letzten dicken Sicherheitsl\u00fccke in der Luca-App, mit Marcus Mengs, Linus Neumann und Tim Pritlove","title":"Logbuch Netzpolitik: Hochsicherheit kommt vor dem Fall","type":"podcast"},{"date":"28.05.2021","dt_created":"2021-11-09 23:00:00","dt_updated":"2021-11-09 23:00:00","id":"96bd85683e82","id_readable":"2021-05-28_doc_Digitalcourage-Braunschweig-Offener-Brief-fr-effiziente-datensparsame-Kontaktverfolgung","links":[{"url":"https:\/\/digitalcourage.de\/blog\/2021\/braunschweig-offener-brief-fuer-effiziente-datensparsame-kontaktverfolgung","text":"Digitalcourage: \u201cBraunschweig: Offener Brief f\u00fcr effiziente, datensparsame Kontaktverfolgung\u201d (digitalcourage.de)"},{"url":"https:\/\/freiheitsfoo.de\/2021\/06\/03\/offener-brief-luca-app\/","text":"Offener Brief der Braunschweiger Digitalcourage: Warnung vor Aberglauben, eine Pandemie mittels Apps besiegen zu k\u00f6nnen \u2013 und wenn schon, dann bitte nicht mit der riskanten Luca-App (freiheitsfoo.de)"}],"references":[{"id":"eb209e94890c"}],"text":"<blockquote>Auch die Corona-Pandemie verf\u00fchrte und verf\u00fchrt viele Politiker, Populisten und technisch wenig versierte Menschen zu dem Aberglauben, technische Mittel und Methoden als Wundermittel im Kampf gegen menschliche oder soziale Probleme \u2013 in diesem Fall die globale Pandemie \u2013 anzusehen und anzupreisen.Eines der \u201ebesten\u201c Beispiele hierf\u00fcr ist der Hype um die Luca-App<\/blockquote>","title":"Digitalcourage: \u201cBraunschweig: Offener Brief f\u00fcr effiziente, datensparsame Kontaktverfolgung\u201d","type":"doc","verified":true},{"date":"28.05.2021","dt_created":"2021-05-28 00:00:00","dt_updated":"2021-05-28 00:00:00","embed":[{"type":"fragdenstaat","id":"221248"}],"id":"c8d701306cd4","id_readable":"2021-05-28_fragdenstaat_fragdenstaatde-Alle-Ihrer-Behrde-vorliegende-Dokumente-zur-Luca-App--zum-Luca-System","links":[{"url":"https:\/\/fragdenstaat.de\/a\/221248","text":"https:\/\/fragdenstaat.de\/a\/221248"}],"scope":"Land: Schleswig-Holstein","tags":["vertrag","kosten"],"text":"","title":"fragdenstaat.de: Alle Ihrer Beh\u00f6rde vorliegende Dokumente zur Luca-App \/ zum Luca-System","type":"fragdenstaat"},{"date":"29.05.2021","dt_created":"2021-05-29 00:00:00","dt_updated":"2021-05-29 00:00:00","embed":[{"type":"fragdenstaat","id":"221300"}],"id":"77c6b7b18d45","id_readable":"2021-05-29_fragdenstaat_fragdenstaatde-Einsatz-der-Luca-App-im-Westerwaldkreis","links":[{"url":"https:\/\/fragdenstaat.de\/a\/221300","text":"https:\/\/fragdenstaat.de\/a\/221300"}],"scope":"Kreis: Westerwaldkreis","tags":["vertrag","kosten","tracing-anfragen"],"text":"Ergebnis: Es ist bisher in keinem Fall zu einer Abfrage von Daten aus der Luca-App gekommen.","title":"fragdenstaat.de: Einsatz der Luca-App im Westerwaldkreis","type":"fragdenstaat"},{"date":"01.06.2021","dt_created":"2021-06-01 00:00:00","dt_updated":"2021-06-01 00:00:00","embed":[{"type":"tweet","url":"https:\/\/twitter.com\/fluepke\/status\/1399790712317751301"},{"type":"gitlab","project":"web","issue":"19"}],"id":"c4f7c1ec7caf","id_readable":"2021-06-01_incident_Schwachstelle-IP-Whitelisting-von-IPv6-Ranges","links":[{"url":"https:\/\/twitter.com\/fluepke\/status\/1399790712317751301","text":"@fluepke auf Twitter"}],"text":"<a href=\"https:\/\/twitter.com\/fluepke\/\">@fluepke<\/a><br>Impact: Gering, aber nur, weil bisher keine IPv6-Adressen in diesem Bereich vergeben sind","title":"Schwachstelle: IP-Whitelisting von IPv6-Ranges","type":"incident"},{"date":"???","dt_created":"1970-01-01 01:00:00","dt_updated":"1970-01-01 01:00:00","id":"b6e463c44cbd","id_readable":"1970-01-01_incident_Schwachstelle-SMS-Verifizierung-in-der-Web-App-ist-clientseitig-aushebelbar","links":[{"url":"https:\/\/github.com\/mame82\/misc\/blob\/master\/cve-luca\/cve-2021-33840.md","text":"Marcus Mengs: CVE-2021-33840 (Github)"}],"tags":["sms-tan","luca-frontend"],"text":"SMS-Verifizierung in der Web-App arbeitet clientseitig, der Server selbst \u201cstateless\u201d; dadurch l\u00e4sst sich die SMS-Verifizierung leicht aushebeln.<br><br>Marcus Mengs<br><br>CVE-2021-33840<br>Impact: Luca Web-App","title":"Schwachstelle: SMS-Verifizierung in der Web-App ist clientseitig aushebelbar","type":"incident"},{"date":"03.06.2021","dt_created":"2021-06-03 00:00:00","dt_updated":"2021-06-03 00:00:00","embed":[{"type":"vimeo","id":"558031958"}],"id":"bcc2077526dd","id_readable":"2021-06-03_event_Zentral---Dezentral---vllig-egal-Eine-kritische-Auseinandersetzung-mit-der-Luca-App","links":[{"url":"http:\/\/www.kampnagel.de\/de\/programm\/was-kann-die-luca-app\/","text":"Programm: Was kann die Luca-App? (kampnagel.de)"},{"url":"https:\/\/vimeo.com\/558031958","text":"Zentral \u2013 Dezentral \u2013 v\u00f6llig egal?: Eine kritische Auseinandersetzung mit der LUCA-App (Vimeo)"}],"tags":["kampnagel","eva-wolfangel","patrick-hennig","amelie-deuflhard","lorena-jaume-palas\u00ed","j\u00f6rn-riedel","judith-horchert"],"text":"Kampgnagel lud im im Rahmen von Claiming Common Spaces III zu einer Diskussion \u00fcber die App Luca und m\u00f6gliche Alternativen, sowie \u00fcber Visionen f\u00fcr institutionelle Digitalisierungsprozesse ein. <br><br>G\u00e4ste: Eva Wolfangel (Wissenschaftsjournalistin), Amelie Deuflhard (Intendantin Kampnagel), Lorena Jaume-Palas\u00ed (Gr\u00fcnderin The Ethical Tech Society), J\u00f6rn Riedel (CIO Freie und Hansestadt Hamburg), Patrick Hennig (CEO neXenio \/ Luca).<br>Moderation: Judith Horchert (DER SPIEGEL, Ressortleiterin Wirtschaft\/Netzwelt).","title":"Zentral - Dezentral - v\u00f6llig egal?: Eine kritische Auseinandersetzung mit der Luca-App","type":"event"},{"date":"05.06.2021","dt_created":"2021-06-05 00:00:00","dt_updated":"2021-06-05 00:00:00","embed":[{"type":"tweet","url":"https:\/\/twitter.com\/ralf\/status\/1401161029602758659"}],"id":"6d7916822f88","id_readable":"2021-06-05_news_NRW-Luca-nicht-mehr-Corona-SchVO-konform","links":[{"url":"https:\/\/www.facebook.com\/permalink.php?story_fbid=3948454441919971&id=539995366099246","text":"Mitteilung Ordnungsamt Essen: Luca kann nicht verordnungskonform in NRW eingesetzt werden; derzeit wird auf eine R\u00fcckmeldung des Landes gewartet, welche Apps mit dem nun kommenden IRIS-Gateway kompatibel sein werden. (Facebook)"}],"scope":"Land: Nordrhein-Westfalen","tags":["iris","NRW"],"text":"Nordrhein-Westfalen hat seine Corona-Schutzverordnung um einen Absatz erg\u00e4nzt, nachdem Location-Betreiber die erfassten Daten bei einer Kontrolle durch Beh\u00f6rden vorweisen und zum Abgleich bereithalten m\u00fcssen. Damit ist Luca in NRW nicht mehr Corona-SchVO-konform einsetzbar.","title":"NRW: Luca nicht mehr Corona-SchVO-konform","type":"news"},{"date":"08.06.2021","dt_created":"2021-11-09 22:00:00","dt_updated":"2021-11-09 22:00:00","embed":[{"type":"fragdenstaat","id":"220970"}],"geo":{"city":"Hannover","state":"Niedersachsen","state_short":"NS","position":{"lat":52.36859298252394,"lng":9.728423323976022}},"id":"6eaa413c5acc","id_readable":"2021-06-08_fragdenstaat_luca-App-in-Niedersachsen-Vertrge-und-Sicherheitsprfungen","tags":["kosten","niedersachsen"],"text":"<blockquote>Die Kosten richten sich im Wesentlichen nach der Zahl der Gesundheits\u00e4mter in Niedersachsen und belaufen sich insgesamt auf 2.521.580 \u20ac (netto) f\u00fcr ein Jahr. Die Beschaffung erfolgte gem\u00e4\u00df \u00a7 14 Abs. 4 Nr. 2 Buchstabe b Vergabeverordnung. Zudem lag zum Zeitpunkt der Beschaffung eine Dringlichkeit im Sinne von \u00a7 14 Abs. 4 Nr. 3 Vergabeverordnung vor.<\/blockquote>Die Vertr\u00e4ge wurden nicht offengelegt und als Begr\u00fcndung f\u00fcr die Wahl Alternativlosigkeit (bei digitalter KV-Pflicht der G\u00c4) angegeben.","title":"luca App in Niedersachsen: Vertr\u00e4ge und Sicherheitspr\u00fcfungen","type":"fragdenstaat"},{"date":"08.06.2021","dt_created":"2021-06-08 00:00:00","dt_updated":"2021-06-08 00:00:00","id":"e401cc987855","id_readable":"2021-06-08_podcast_She-likes-Tech-26---Luca-Fehler-im-System","links":[{"url":"https:\/\/www.ndr.de\/nachrichten\/info\/podcast4808.html","text":"She likes Tech #26 - Luca: Fehler im System (Seite zum Einzelbeitrag)"},{"url":"https:\/\/www.ndr.de\/nachrichten\/info\/podcast4808.html","text":"NDR info: She Likes Tech - der Podcast \u00fcber Technologie (Gesamtseite des Podcasts)"}],"text":"Bianca Kastl ist zu Gast bei \"She likes Tech\", einem Tech-Podcast der beiden Tech-Journalistinnen Eva K\u00f6hler und Svea Eckert.","title":"She likes Tech #26 - Luca: Fehler im System","type":"podcast"},{"date":"09.06.2021","dt_created":"2021-06-09 00:00:00","dt_updated":"2021-06-09 00:00:00","embed":[{"type":"ardmediathek","id":"Y3JpZDovL2Rhc2Vyc3RlLmRlL3BsdXNtaW51cy8wOTgyNGJmNS1iOThjLTQ1OGItYWFhMy1lMGEzMjY2ZGJhZTg"}],"id":"a502783ca88d","id_readable":"2021-06-09_broadcast_ARD-Plusminus-Sendung-vom-9-Juni-2021-LUCA-App---mehr-Kosten-als-Nutzen","links":[{"url":"https:\/\/www.daserste.de\/information\/wirtschaft-boerse\/plusminus\/videos\/sendung-vom-09-06-2021-luca-app-video-100.html","text":"Plusminus-Sendung vom 09. Juni 2021 - Video: LUCA-App \u2013 mehr Kosten als Nutzen (daserste.de)"}],"tags":["ard","plusminus"],"text":"Beitrag bei ARD Plusminus, u.a. mit Manuel Atug, Dr. Michael Ziemons (Leiter Gesundheitsamt Aachen) und Max Kiehnscherf im Interview.<ul><li>Die LUCA-App zur Kontaktnachverfolgung wurde vollmundig angek\u00fcndigt; inzwischen gro\u00dfe Skepsis bei Datensicherheit<\/li><li>\u00dcber App konnten hochsensible Daten der Gesundheits\u00e4mter gehackt werden \u2013 vom Gewicht der Kinder bis Leichenschau<\/li><li>IT-Experten finden st\u00e4ndig neue Risiken, weil Grundproblem nicht behoben wird<\/li><li>App-Entwickler r\u00e4umen Gefahren ein<\/li><li>13 Bundesl\u00e4nder haben 21 Millionen Euro in App investiert<\/ul>","title":"ARD Plusminus: Sendung vom 9. Juni 2021: LUCA-App - mehr Kosten als Nutzen","type":"broadcast"},{"date":"10.06.2021","dt_created":"2021-06-10 00:00:00","dt_updated":"2021-06-10 00:00:00","geo":{"city":"Augsburg","state":"Bayern","state_short":"BY","position":{"lat":48.37757948970364,"lng":10.89240761580469}},"id":"32b177495843","id_readable":"2021-06-10_news_Interview-mit-Peter-Lachenmair-Kritik-an-der-Luca-App-Geht-Schwaben-den-richtigen-Weg","links":[{"url":"https:\/\/www.b4bschwaben.de\/b4b-nachrichten\/augsburg_artikel,-kritik-an-der-luca-app-geht-schwaben-den-richtigen-weg-_arid,264302.html","text":"Interview mit Peter Lachenmair: \u201cKritik an der Luca App: Geht Schwaben den richtigen Weg?\u201d (b4bschwaben.de)"}],"title":"Interview mit Peter Lachenmair: \u201cKritik an der Luca App: Geht Schwaben den richtigen Weg?\u201d","type":"news"},{"date":"10.06.2021","dt_created":"2021-06-10 00:00:00","dt_updated":"2021-06-10 00:00:00","embed":[{"type":"tweet","url":"https:\/\/twitter.com\/markus_bublitz\/status\/1403092238914183177"}],"id":"b2505a7adb85","id_readable":"2021-06-10_news_IRIS-Gateway-Luca-ist-bisher-nicht-angeschlossen","tags":["iris"],"text":"","title":"IRIS Gateway: Luca ist bisher nicht angeschlossen.","type":"news"},{"date":"14.06.2021","dt_created":"2021-06-14 00:00:00","dt_updated":"2021-06-14 00:00:00","embed":[{"type":"fragdenstaat","id":"223372"}],"id":"8c1748e5af9d","id_readable":"2021-06-14_fragdenstaat_fragdenstaatde-LUCA-Software","links":[{"url":"https:\/\/fragdenstaat.de\/a\/223372","text":"https:\/\/fragdenstaat.de\/a\/223372"}],"scope":"Kreis: Mayen-Koblenz","tags":[],"text":"","title":"fragdenstaat.de: LUCA-Software","type":"fragdenstaat"},{"date":"14.06.2021","dt_created":"2021-06-14 00:00:00","dt_updated":"2021-06-14 00:00:00","id":"0da0b937230d","id_readable":"2021-06-14_news_Corona-Warn-App-hat-ber-100000-Infektionsketten-unterbrochen","links":[{"url":"https:\/\/heise.de\/-6070747","text":"Holger Bleich: RKI-Sch\u00e4tzung: Corona-Warn-App hat \u00fcber 100.000 Infektionsketten unterbrochen (heise.de)"}],"text":"... und damit einen \u00e4hnlich gro\u00dfen Beitrag zur Eind\u00e4mmung der Pandemie geleistet wie alle Gesundheits\u00e4mter gemeinsam (die zu einem kleinen Teil u.a. auch Luca einsetzen).","title":"Corona-Warn-App hat \u00fcber 100.000 Infektionsketten unterbrochen","type":"news"},{"date":"15.06.2021","dt_created":"2021-06-15 00:00:00","dt_updated":"2021-06-15 00:00:00","embed":[{"type":"tweet","url":"https:\/\/twitter.com\/MalteEngeler\/status\/1404796425792331776"}],"id":"f4b31ec9e9d6","id_readable":"2021-06-15_incident_Luca-nutzt-Impfzertifikate-um-Kontaktdaten-zu-validieren","links":[{"url":"https:\/\/twitter.com\/mame82\/status\/1404720191066492930","text":"Tweet von Marcus Mengs zum Thema (Twitter)"},{"url":"https:\/\/eur-lex.europa.eu\/legal-content\/DE\/TXT\/?uri=CELEX:32021R0953","text":"Verordnung (EU) 2021\/953 des Europ\u00e4ischen Parlaments und des Rates vom 14. Juni 2021 \u00fcber einen Rahmen f\u00fcr die Ausstellung, \u00dcberpr\u00fcfung und Anerkennung interoperabler Zertifikate zur Bescheinigung von COVID-19-Impfungen und -Tests sowie der Genesung von einer COVID-19-Infektion (digitales COVID-Zertifikat der EU) (eur-lex.europa.eu)"}],"tags":["impfzertifikat"],"text":"","title":"Luca nutzt Impfzertifikate, um Kontaktdaten zu validieren","type":"incident"},{"date":"15.06.2021","dt_created":"2021-06-15 00:00:00","dt_updated":"2021-06-15 00:00:00","embed":[{"type":"fragdenstaat","id":"223453"}],"geo":{"city":"Pellenz","state":"Rheinland-Pfalz","state_short":"RP","position":{"lat":50.438351963626744,"lng":7.403468885585047}},"id":"39cfa22c1757","id_readable":"2021-06-15_fragdenstaat_fragdenstaatde-LUCA-Werbung","links":[{"url":"https:\/\/fragdenstaat.de\/a\/223453","text":"https:\/\/fragdenstaat.de\/a\/223453"}],"scope":"Kreis: Verbandsgemeindeverwaltung Pellenz","tags":[],"text":"","title":"fragdenstaat.de: LUCA Werbung","type":"fragdenstaat"},{"date":"15.06.2021","dt_created":"2021-06-15 00:00:00","dt_updated":"2021-06-15 00:00:00","geo":{"city":"Osnabr\u00fcck","state":"Niedersachsen","state_short":"NS","position":{"lat":52.2745964094605,"lng":8.04270003592918}},"id":"6001b7b2f457","id_readable":"2021-06-15_Verwaltungsgericht-Osnabrck-Landkreis-Osnabrck-darf-auf-seiner-Website-nicht-allein-fr-die-LUCA-App-werben","links":[{"url":"https:\/\/www.verwaltungsgericht-osnabrueck.niedersachsen.de\/aktuelles\/pressemitteilungen\/landkreis-osnabruck-darf-auf-seiner-website-nicht-allein-fur-die-luca-app-werben-201423.html","text":"Pressinformation des Verwaltungsgerichts Osnabr\u00fcck (verwaltungsgericht-osnabrueck.niedersachsen.de)"},{"url":"http:\/\/archive.today\/2021.05.05-150340\/https:\/\/corona-os.de\/node\/485","text":"Snapshot von corona-os.de: \u201cDarum unterst\u00fctzen Stadt und Landkreis den Einsatz von luca\u201d (archive.is)"},{"url":"https:\/\/rundblick-unna.de\/2021\/06\/15\/gericht-urteilt-kommune-darf-nicht-einseitig-fuer-luca-app-werben\/","text":"\u201cGericht urteilt: Kommune darf nicht einseitig f\u00fcr LUCA-App werben\u201d (rundblick-unna.de)"},{"url":"https:\/\/osna-live.de\/26382\/amtsgericht-osnabrueck-landkreis-darf-nicht-allein-fuer-luca-app-werben\/","text":"\u201cAmtsgericht Osnabr\u00fcck: Landkreis darf nicht allein f\u00fcr LUCA-App werben\u201d (osna-live.de)"},{"url":"https:\/\/dejure.org\/dienste\/vernetzung\/rechtsprechung?Gericht=VG%20Osnabr%FCck&Datum=2021-06-15&Aktenzeichen=1%20B%2024\/21","text":"Rechtssprechung: VG Osnabr\u00fcck, 15.06.2021 - Aktenzeichen 1 B 24\/21 (dejure.org)"}],"scope":"Kreis: Osnabr\u00fcck","text":"Der Landkreis Osnabr\u00fcck warb auf seiner Webseite <a href\"https:\/\/corona-os.de\/\" target=\"_blank\">corona-os.de<\/a> ausschlie\u00dflich und explizit f\u00fcr die Luca-App. Das Verwaltungsgericht Osnabr\u00fcck stellte nun klar: Wenn geworben wird, dann nicht ausschlie\u00dflich nur f\u00fcr eine App.","title":"Verwaltungsgericht Osnabr\u00fcck: Landkreis Osnabr\u00fcck darf auf seiner Website nicht allein f\u00fcr die LUCA-App werben","verified":true},{"date":"15.06.2021","dt_created":"2021-06-15 00:00:00","dt_updated":"2021-06-15 00:00:00","embed":[{"type":"fragdenstaat","id":"223455"}],"id":"e25de04bfdf2","id_readable":"2021-06-15_fragdenstaat_fragdenstaatde-LUCA-System-im-Kreis-Mayen-Koblenz","links":[{"url":"https:\/\/fragdenstaat.de\/a\/223455","text":"https:\/\/fragdenstaat.de\/a\/223455"}],"scope":"Kreis: Mayen-Koblenz","tags":[],"text":"Infektionsf\u00e4lle bei denen in diesem Zeitraum Daten aus der Luca-App f\u00fcr eine Kontaktverfolgung herangezogen werden mussten oder eine Kontaktverfolgung ausschlie\u00dflich mit Hilfe der LUCA-App m\u00f6glich war sind nicht zu verzeichnen","title":"fragdenstaat.de: LUCA System im Kreis Mayen-Koblenz","type":"fragdenstaat"},{"date":"15.06.2021","dt_created":"2021-06-15 00:00:00","dt_updated":"2021-06-15 00:00:00","embed":[{"type":"fragdenstaat","id":"223590"}],"geo":{"city":"Schw\u00e4bisch Hall","state":"Baden-W\u00fcrttemberg","state_short":"BW","position":{"lat":49.12279483693555,"lng":9.754675510920487}},"id":"d628a4a47700","id_readable":"2021-06-15_fragdenstaat_fragdenstaatde-Einsatz-der-Luca-App-im-Landkreis-Schwbisch-Hall","links":[{"url":"https:\/\/fragdenstaat.de\/a\/223590","text":"https:\/\/fragdenstaat.de\/a\/223590"}],"scope":"Kreis: Schw\u00e4bisch Hall","tags":[],"text":"","title":"fragdenstaat.de: Einsatz der Luca-App im Landkreis Schw\u00e4bisch Hall","type":"fragdenstaat"},{"date":"18.06.2021","dt_created":"2021-06-18 00:00:00","dt_updated":"2021-06-18 00:00:00","embed":[{"type":"tweet","url":"https:\/\/twitter.com\/mame82\/status\/1405855701830938627"}],"id":"21c9f5fd3ebc","id_readable":"2021-06-18_incident_Schwachstelle-Denial-of-Service-Attacken-auf-Gesundheitsmter-schon-wieder-mglich","links":[{"url":"https:\/\/twitter.com\/mame82\/status\/1405855701830938627","text":"Tweet von Marcus Mengs zum Thema, mit Demo (Twitter)"}],"text":"Denial of Service-Attacken auf Gesundheits\u00e4mter durch manipulierte Nutzerdaten sind auch mit der Backend version v1.2.1 von Luca m\u00f6glich.","title":"Schwachstelle: Denial of Service-Attacken auf Gesundheits\u00e4mter (schon wieder) m\u00f6glich","type":"incident"},{"date":"19.06.2021","dt_created":"2021-06-19 00:00:00","dt_updated":"2021-06-19 00:00:00","embed":[{"type":"tweet","url":"https:\/\/twitter.com\/mame82\/status\/1406281381756518405"},{"type":"tweet","url":"https:\/\/twitter.com\/Wasserbombe\/status\/1406284815343800329"}],"id":"31266d8751bd","id_readable":"2021-06-19_incident_IT-Security-Experte-Marcus-Mengs-stellt-kostenlose-ZuarbeitHinweise-in-Form-von-Dokumenation-mglicher-Sicherheitsprobleme-zur-Luca-App-ein","links":[{"url":"https:\/\/github.com\/mame82\/LucaAppIssues\/blob\/main\/abandoned_issues.md","text":"Dokumentation von weiteren Sicherheitsl\u00fccken und Auff\u00e4lligkeiten von Marcus Mengs (github.com)"}],"text":"","title":"IT-Security-Experte Marcus Mengs stellt (kostenlose) Zuarbeit\/Hinweise in Form von Dokumenation m\u00f6glicher Sicherheitsprobleme zur Luca-App ein","type":"incident"},{"date":"19.06.2021","dt_created":"2021-06-19 00:00:00","dt_updated":"2021-06-19 00:00:00","embed":[{"type":"tweet","url":"https:\/\/twitter.com\/mame82\/status\/1406269269873201159"},{"type":"vimeo","id":"565012610"}],"id":"ca01a438cfee","id_readable":"2021-06-19_incident_Schwachstelle-Ransomware-Angriffe-auf-Gesundheitsmter-schon-wieder-ber-Luca-mglich","links":[{"url":"https:\/\/twitter.com\/mame82\/status\/1406269269873201159","text":"Twitter-Thread von Marcus Mengs zum Thema (twitter.com)"},{"url":"https:\/\/github.com\/mame82\/LucaAppIssues\/blob\/main\/abandoned_issues.md","text":"Dokumentation von weiteren Sicherheitsl\u00fccken und Auff\u00e4lligkeiten von Marcus Mengs (github.com)"}],"text":"","title":"Schwachstelle: Ransomware-Angriffe auf Gesundheits\u00e4mter (schon wieder) \u00fcber Luca m\u00f6glich","type":"incident","verified":true},{"date":"20.06.2021","dt_created":"2021-06-20 00:00:00","dt_updated":"2021-06-20 00:00:00","id":"0a4972117264","id_readable":"2021-06-20_news_Enno-Lenze-Aktuelle-Probleme-der-Luca-App","links":[{"url":"https:\/\/www.berlinstory-news.de\/aktuelle-probleme-der-luca-app\/","text":"Enno Lenze: Aktuelle Probleme der Luca App (berlinstory-news.de)"}],"text":"<blockquote>Den Benutzern also zu erkl\u00e4ren, dass sie die Luca-App aufgrund der Code-Qualit\u00e4t nicht nutzen sollen, ist eine Sackgasse.<\/blockquote>","title":"Enno Lenze: \u201cAktuelle Probleme der Luca App\u201d","type":"news"},{"date":"22.06.2021","dt_created":"2021-06-22 00:00:00","dt_updated":"2021-06-22 00:00:00","embed":[{"type":"fragdenstaat","id":"219865"}],"id":"87e92fbfbd85","id_readable":"2021-06-22_fragdenstaat_Bundesdruckerei-beantwortet-keine-IFG-Anfragen-zu-Luca-da-sie-juristische-Person-des-Privatrechts-ist","links":[{"url":"https:\/\/fragdenstaat.de\/a\/219865","text":"https:\/\/fragdenstaat.de\/a\/219865"}],"scope":"Bundesweit","tags":["bundesdruckerei"],"text":"","title":"Bundesdruckerei beantwortet keine IFG-Anfragen zu Luca, da sie juristische Person des Privatrechts ist","type":"fragdenstaat","verified":true},{"date":"24.06.2021","dt_created":"2021-06-24 00:00:00","dt_updated":"2021-06-24 00:00:00"